noc,expertise,skills,knowledge
NOC 4162,"['Conduct research', 'Develop models to analyze, explain and forecast economic behaviour and patterns', 'Devise methods for collection and analysis of data', 'Forecast production and consumption of products', 'Forecast income and expenditure, interest rates and exchange rates', 'Analyze factors which determine economic growth', 'Advise government agencies on policies to increase economic activities', 'Study mathematical formulas and statistical techniques', 'Apply statistical techniques to the testing and quantifying of economic theories and the solution of economic problems', 'Analyze factors which determine labour market outcomes', 'Study the nature of money, credit and credit instruments and the operation of banks and other financial institutions', 'Assess the appropriateness of the current stance of monetary and fiscal policy', 'Develop monetary policies and forecasts of financial activity', 'Examine problems related to the economic activity of individual companies', 'Assess business opportunities and develop strategies', 'Examine financing methods, production costs and techniques and marketing policies to recommend improvements', 'Examine statistical data on the exchange of goods and services among nations', 'Forecast production and consumption of renewable resources', 'Forecast supply, consumption and depletion of non-renewable resources', 'Conduct research on market conditions in local, regional or national areas', 'Prepare research papers, educational texts or articles', 'Provide consulting services to government and other organizations', 'Study regulatory processes and provide material in support of legal proceedings', 'Forecast production and consumption of specific products and services', 'Deliver presentations at conferences, workshops or symposia']","['Management : Strategic Planning', 'Analysis : Analyzing Information', 'Analysis : Examining and Diagnosing', 'Analysis : Projecting Outcomes', 'Analysis : Researching and Investigating', 'Communication : Advising and Consulting', 'Communication : Professional Communicating', 'Information Handling : Managing Information', 'Creative Expression : Writing']","['Business, Finance and Management : Economics', 'Business, Finance and Management : Finance', 'Mathematics and Science : Mathematics', 'Mathematics and Science : Statistics']"
NOC 4166,"['Conduct research', 'Produce reports', 'Administer education policies and programs', 'Evaluate curriculum programs and recommend improvements', 'Develop the structure, content and objectives of new programs', 'Conduct statistical analyses to determine cost and effectiveness of education policies and programs', 'Provide on-going professional development, training and consultative services to teachers', 'Develop teaching materials and other resources for program delivery', 'Prepare research papers, educational texts or articles', 'Provide consulting services to government and other organizations', 'Deliver presentations at conferences, workshops or symposia']","['Management : Evaluating', 'Management : Supervising', 'Analysis : Analyzing Information', 'Analysis : Planning', 'Analysis : Projecting Outcomes', 'Analysis : Researching and Investigating', 'Communication : Advising and Consulting', 'Communication : Professional Communicating', 'Communication : Teaching and Training', 'Information Handling : Managing Information', 'Creative Expression : Writing']","['Business, Finance and Management : Business  Administration', 'Education and Training : Teaching and Instruction', 'Mathematics and Science : Statistics', 'Social Sciences and Arts : Sociology and Anthropology']"
NOC 4211,"['Assist lawyers by interviewing clients, witnesses and other related parties, assembling documentary evidence, preparing trial briefs, and arranging for trials', 'Prepare wills, real estate transactions and other legal documents, court reports and affidavits', 'Research records, court files and other legal documents', 'Assist lawyers in preparation for mediation and judicial dispute resolutions', 'Draft legal correspondence and perform general office and clerical duties', 'Draft contracts, prepare promissory notes and draw up wills, mortgages and other legal documents', 'Administer oaths and take affidavits and depositions', 'Arrange probates and administer the estates of deceased persons', 'Witness and certify the validity of signatures on documents', 'Advise clients on intellectual property matters and represent clients before the Registrar of Trade-Marks', 'Represent clients at proceedings before the Trade Marks Opposition Board and in related proceedings', 'Advise on the registrability of trademarks, trademark licensing requirements, transfer of intellectual property and protection of existing trademark rights', 'Represent clients internationally in consultation with foreign associates and attorneys']","['Management : Co-ordinating and Organizing', 'Analysis : Analyzing Information', 'Analysis : Researching and Investigating', 'Communication : Interviewing', 'Communication : Professional Communicating', 'Communication : Advising and Consulting', 'Communication : Negotiating and Adjudicating', 'Information Handling : Processing Information']","['Business, Finance and Management : Clerical', 'Law and Public Safety : Law, Government, and Jurisprudence', 'Law and Public Safety : Public Safety and Security', 'Social Sciences and Arts : Philosophy and Theology']"
NOC 4217,"['Assist at services of public worship and religious rites', 'Provide religious education, spiritual guidance and moral support', 'Administer programs providing food, clothing and shelter']","['Service and Care : Counselling and Nurturing', 'Service and Care : Serving Others', 'Communication : Advising and Consulting', 'Communication : Professional Communicating', 'Communication : Teaching and Training']","['Education and Training : Teaching and Instruction', 'Social Sciences and Arts : Philosophy and Theology']"
NOC 5113,"['Appraise and acquire archival materials', 'Develop and maintain archival collection', 'Authenticate historical documents and records', 'Research the origins and historical significance of archival materials', 'Assist users in accessing archival materials', 'Develop policies and procedures to manage corporate cataloguing systems, records scheduling and disposal, and finding aids', 'Organize noncurrent archives and develop cataloguing and retrieval systems to allow access to archival materials', 'Plan the computerized management of archives and the management of electronic archives', 'Design programs for managing, disseminating and storing archives of all types']","['Service and Care : Serving Others', 'Management : Allocating and Controlling Resources', 'Analysis : Analyzing Information', 'Analysis : Planning', 'Analysis : Researching and Investigating', 'Information Handling : Managing Information', 'Information Handling : Processing Information', 'Handling Goods and Materials : Sorting']","['Business, Finance and Management : Clerical', 'Engineering and Technology : Computer and Information Systems', 'Social Sciences and Arts : History and Archaeology', 'Social Sciences and Arts : Library and Heritage']"
NOC 5123,"['Collect information through interview, investigation and observation', 'Receive, analyze and verify copy for accuracy', 'Arrange for and conduct interviews as part of research, for publication or for broadcast', 'Write editorials and commentaries on topics of current interest to stimulate public interest and express the views of a publication or broadcasting station', 'Write critical reviews of literary, musical and other artistic works based on knowledge, judgement and experience', 'Research and report on developments in specialized fields such as medicine, science and technology', 'Write news stories for publication and broadcast']","['Analysis : Analyzing Information', 'Analysis : Researching and Investigating', 'Communication : Liaising and Networking', 'Communication : Interviewing', 'Communication : Professional Communicating', 'Creative Expression : Writing']","['Communications and Transportation : Communications and Media', 'Law and Public Safety : Law, Government, and Jurisprudence', 'Social Sciences and Arts : Languages (English and French)']"
NOC 5135,"['Train students in interpretation of skills, speech, movement and dramatic theory', 'Prepare acting students for specific auditions and performances', 'Attend auditions and casting roles', 'Improvise a role', 'Study and rehease lines from scripts', 'Sing or dance', 'Interpret, memorize lines, stunts and cues', 'Portray roles in several productions', 'Perform comedy acts']","['Management : Evaluating', 'Analysis : Analyzing Information', 'Analysis : Planning', 'Analysis : Projecting Outcomes', 'Communication : Professional Communicating', 'Communication : Teaching and Training', 'Creative Expression : Performing and Entertaining']","['Education and Training : Teaching and Instruction', 'Social Sciences and Arts : Fine and Applied Arts', 'Social Sciences and Arts : Languages (English and French)']"
NOC 5212,"['Construct displays and dioramas, build models, install artifacts in displays and prepare artifacts for storage and shipping', 'Fabricate custom frames, measure and cut mats, mat enhancements and glass, and mount paintings, photographs and other art work', 'Conduct guided tours of museums, gallery exhibitions and historical, heritage and other sites, answer inquiries and provide information', 'Assist with the planning and development of travelling exhibitions and special events', 'Protect and care for cultural artifacts and collections during exhibitions, while in transit and in storage', 'Assist in the restoration and conservation of artifacts under the direction of a conservator', 'Assist in the research, handling and storage of artifacts', 'Classify and assign registration numbers to artifacts and supervise inventory control', 'Prepare and mount skins of birds or animals for preservation, scientific or display purposes']","['Service and Care : Serving Others', 'Building : Constructing', 'Building : Restoring and Repairing', 'Analysis : Inspecting and Testing', 'Analysis : Planning', 'Analysis : Researching and Investigating', 'Communication : Professional Communicating', 'Communication : Teaching and Training', 'Information Handling : Processing Information']","['Engineering and Technology : Design', 'Mathematics and Science : Chemistry', 'Social Sciences and Arts : History and Archaeology', 'Social Sciences and Arts : Library and Heritage']"
NOC 5224,"['Monitor broadcast quality of live or taped radio and television programs', 'Operate and monitor radio and television broadcasting systems to broadcast, receive signals and to regulate clarity and range of sounds and colours of recordings or broadcasts', 'Make emergency repairs to equipment', 'Set up and operate consoles to pick up and select feed sources from different locations', 'Maintain, install and troubleshoot a wide variety of broadcast hardware and software', 'Operate broadcast equipment to produce audio and video streaming broadcasts for the Internet', 'Put to air radio and television programs and commercials']","['Working with Technological Equipment and Machinery : Debugging and Reprogramming Technical Systems', 'Working with Technological Equipment and Machinery : Installing and Setting-Up Technical Infrastructure', 'Working with Technological Equipment and Machinery : Using Specialized Instrumentation and Equipment', 'Management : Evaluating', 'Management : Supervising', 'Analysis : Examining and Diagnosing']","['Communications and Transportation : Communications and Media', 'Communications and Transportation : Telecommunications', 'Engineering and Technology : Computer and Information Systems', 'Engineering and Technology : Electricity (Electrical and Electronics)', 'Engineering and Technology : Engineering and Applied Technologies']"
NOC 5231,"['Select and introduce music, videos and other entertainment material for broadcast, and make commercial and public service announcements', 'Act as host/hostess or master of ceremonies, introduce and interview guests and conduct proceedings of shows or programs', 'Read news, sports and weather for radio and television', 'Report on weather conditions using information provided by weather forecasting services', 'Report on traffic conditions by maintaining contact with external sources of information or by observing traffic from air or land vehicle']","['Analysis : Analyzing Information', 'Communication : Interviewing', 'Communication : Liaising and Networking', 'Communication : Professional Communicating', 'Information Handling : Processing Information', 'Creative Expression : Performing and Entertaining', 'Creative Expression : Writing']","['Communications and Transportation : Communications and Media', 'Communications and Transportation : Telecommunications', 'Social Sciences and Arts : Languages (English and French)']"
NOC 5253,"['Officiate at sporting events or athletic competitions to maintain standards of play', 'Ensure that game rules are observed', 'Record lapsed time during event or competition', 'Judge the performance of competitors, award points, impose penalties for infractions and determine results', 'Compile scores and other athletic records', 'Verify credentials of athletes or animals engaged in sports or related special events']","['Service and Care : Protecting and Enforcing', 'Management : Evaluating', 'Management : Supervising', 'Analysis : Analyzing Information', 'Communication : Liaising and Networking', 'Communication : Professional Communicating', 'Communication : Negotiating and Adjudicating', 'Information Handling : Processing Information']","['Business, Finance and Management : Personnel and Human Resources', 'Law and Public Safety : Law, Government, and Jurisprudence', 'Law and Public Safety : Public Safety and Security']"
NOC 6211,"['Assign sales workers to duties', 'Authorize payments by cheque', 'Authorize return of merchandise', 'Sell merchandise', 'Prepare reports on sales volumes, merchandising and personnel matters', 'Resolve problems that arise, such as customer complaints and supply shortages', 'Organize and maintain inventory', 'Supervise and co-ordinate activities of workers']","['Management : Co-ordinating and Organizing', 'Management : Recruiting and Hiring', 'Management : Supervising', 'Analysis : Analyzing Information', 'Communication : Promoting and Selling', 'Communication : Teaching and Training', 'Information Handling : Processing Information']","['Business, Finance and Management : Client  Service', 'Business, Finance and Management : Sales']"
NOC 6315,"['Supervise and co-ordinate activities of workers', 'Inspect sites or facilities to ensure safety and cleanliness standards', 'Recommend or arrange for additional maintenance services', 'Receive payment for specialized cleaning jobs', 'Assist cleaners in performing duties', 'Co-ordinate work activities with other departments', 'Establish work schedules']","['Service and Care : Cleaning and House/Shop Keeping', 'Management : Recruiting and Hiring', 'Management : Co-ordinating and Organizing', 'Management : Supervising', 'Analysis : Inspecting and Testing', 'Analysis : Planning', 'Analysis : Projecting Outcomes', 'Analysis : Analyzing Information', 'Communication : Teaching and Training', 'Information Handling : Processing Information']","['Business, Finance and Management : Clerical', 'Business, Finance and Management : Personnel and Human Resources', 'Law and Public Safety : Public Safety and Security']"
NOC 6321,"['Arrange for equipment purchases and repairs', 'Plan menus and ensure food meets quality standards', 'Supervise activities of sous-chefs, specialist chefs, chefs and cooks', 'Recruit and hire staff', 'Consult with clients regarding weddings, banquets and specialty functions', 'Plan and direct food preparation and cooking activities of several restaurants', 'Estimate food requirements and food and labour costs', 'Supervise activities of specialist chefs, chefs, cooks and other kitchen workers', 'Demonstrate new cooking techniques and new equipment to cooking staff', 'Instruct cooks in preparation, cooking, garnishing and presentation of food', 'Create new recipes', 'Supervise cooks and other kitchen staff', 'Prepare and cook complete meals and specialty foods for events such as banquets']","['Service and Care : Cooking, Preparing, Serving', 'Operating and Repairing Equipment, Machinery and Vehicles : Operating Stationary Industrial Equipment', 'Management : Recruiting and Hiring', 'Management : Supervising', 'Analysis : Analyzing Information', 'Analysis : Planning', 'Analysis : Projecting Outcomes', 'Communication : Advising and Consulting', 'Communication : Teaching and Training', 'Information Handling : Processing Information', 'Creative Expression : Designing']","['Business, Finance and Management : Business  Administration', 'Business, Finance and Management : Client  Service', 'Manufacturing and Production : Food Production and Agriculture', 'Mathematics and Science : Chemistry']"
NOC 6341,"[""Cut and trim hair according to client's instructions or preferences"", 'Shave and trim beards and mustaches', 'Provide other hair treatment, such as waving, straightening and tinting and also provide scalp conditioning massages', 'Clean and style wigs and hair pieces', 'Apply bleach, tints, dyes or rinses to colour, frost or streak hair', 'Analyze hair and scalp condition and provide basic treatment or advice on beauty care treatments for scalp and hair', ""Suggest hair style compatible with client's physical features or determine style from client's instructions and preferences"", 'Cut, trim, taper, curl, wave, perm and style hair', 'Apply hair extensions']","['Management : Supervising', 'Analysis : Analyzing Information', 'Communication : Advising and Consulting', 'Communication : Promoting and Selling', 'Communication : Teaching and Training', 'Information Handling : Processing Information', 'Creative Expression : Designing']","['Business, Finance and Management : Client  Service', 'Mathematics and Science : Chemistry']"
NOC 6512,"['Organize and set up bar', 'Clean bar area and wash glassware', 'Clean draft beer system', 'Advise on wine selection', 'Inform customers regarding contents of cocktails or other drinks', 'Collect cash, credit/debit cards or other payment for beverages', 'Record and balance beverage sales', 'Store beverage and food products', 'Order bar stock and maintain inventory and control of bar stock', 'Enforce provincial/territorial liquor legislation and regulations', 'Take beverage orders from serving staff or directly from patrons', 'Prepare mixed drinks, wine, draft or bottled beer and non-alcoholic beverages']","['Service and Care : Cooking, Preparing, Serving', 'Service and Care : Protecting and Enforcing', 'Service and Care : Serving Others', 'Management : Recruiting and Hiring', 'Management : Supervising', 'Analysis : Planning', 'Communication : Promoting and Selling', 'Information Handling : Processing Information']","['Business, Finance and Management : Client  Service', 'Law and Public Safety : Public Safety and Security']"
NOC 4421,"['Escort prisoners to and from courts and correctional institutions', 'Locate property and make seizures and removals under various acts of Parliament', 'Provide courthouse security for judges and perimeter security for the courthouse', 'Serve statements of claims, summonses, warrants, jury summonses, orders to pay spousal support, and other court orders', 'Serve writs of execution by seizing and selling property and distributing the proceeds according to court decisions', 'Prepare comprehensive reports and affidavits and maintain records', 'Issue warrants for imprisonment, arrest or apprehension', 'Attend court, escort witnesses and assist in maintaining order', 'Ensure security support services for sequestered juries']","['Service and Care : Serving Others', 'Service and Care : Protecting and Enforcing', 'Communication : Professional Communicating', 'Information Handling : Processing Information']","['Business, Finance and Management : Sales', 'Law and Public Safety : Law, Government, and Jurisprudence', 'Law and Public Safety : Public Safety and Security']"
NOC 4413,"['Help students individually or in small groups with assignments and reinforce learning and retention concepts under the supervision of classroom teacher', 'Assist students with integration into the classroom and school setting', 'Accompany and supervise students during activities in school gymnasiums, laboratories, libraries, resource centres and on field trips', 'Monitor and report student progress to classroom teacher', 'Assist students with special needs using techniques such as sign language, braille and remedial programs']","['Service and Care : Tending to Daily Needs', 'Service and Care : Serving Others', 'Service and Care : Protecting and Enforcing', 'Analysis : Analyzing Information', 'Communication : Teaching and Training', 'Information Handling : Processing Information']","['Education and Training : Teaching and Instruction', 'Health Services : Therapy and Counselling', 'Social Sciences and Arts : Languages Foreign', 'Social Sciences and Arts : Psychology']"
NOC 7612,"['Move tools, equipment and other materials', 'Hold stakes during surveying activities', 'Signal safety procedures to other workers and to the general public', 'Perform miscellaneous labouring activities to help tradespersons, apprentices and other workers as directed', 'Clean machines and immediate work areas']","['Service and Care : Cleaning and House/Shop Keeping', 'Service and Care : Serving Others', 'Operating and Repairing Equipment, Machinery and Vehicles : Mechanical Installing, Maintaining and Repairing', 'Operating and Repairing Equipment, Machinery and Vehicles : Operating Mobile Equipment', 'Handling Goods and Materials : Loading and Unloading']","['Engineering and Technology : Mechanics and Machinery', 'Engineering and Technology : Electricity (Electrical and Electronics)', 'Law and Public Safety : Public Safety and Security']"
NOC 7231,"['Read and interpret engineering drawings, blueprints, charts and tables', 'Repair machine tools and parts', 'Set up and adjust production machineries/tools', 'Fit and assemble components and machine parts to close tolerance', 'Maintain, repair and calibrate precision measuring instruments', 'Document and report deviations from specifications and tolerances', 'Maintain inspection records and complete inspection reports', 'Verify dimensions of parts machined using precise measuring instruments (e.g., micrometers, calipers)', 'Verify dimensions of products for accuracy and conformance to specifications using precision measuring instruments', 'Set up, operate and maintain a variety of conventional and computer numerically controlled (CNC) machine tools', 'Compute dimensions and tolerances and measure and lay out work pieces']","['Working with Technological Equipment and Machinery : Using Specialized Instrumentation and Equipment', 'Operating and Repairing Equipment, Machinery and Vehicles : Operating Stationary Industrial Equipment', 'Building : Constructing', 'Analysis : Analyzing Information', 'Analysis : Inspecting and Testing', 'Analysis : Planning', 'Information Handling : Processing Information']","['Engineering and Technology : Mechanics and Machinery', 'Manufacturing and Production : Processing and Production', 'Mathematics and Science : Physics']"
NOC 7242,"['Install, examine, replace or repair electrical wiring, receptacles, switch boxes, conduits, feeders, fibre-optic and coaxial cable assemblies, lighting fixtures and other electrical components', 'Test electrical and electronic equipment and components for continuity, current, voltage and resistance', 'Maintain, repair, install and test switchgear, transformers, switchboard meters, regulators and reactors', 'Maintain, repair, test and install electrical motors, generators, alternators, industrial storage batteries and hydraulic and pneumatic electrical control systems', 'Troubleshoot, maintain and repair industrial, electrical and electronic control systems and other related devices', 'Interpret electrical code specifications', 'Conduct preventive maintenance programs and keep maintenance records', 'Read and interpret drawings, blueprints, schematics and electrical code specifications to determine layout of industrial electrical equipment installations']","['Working with Technological Equipment and Machinery : Installing and Setting-Up Technical Infrastructure', 'Operating and Repairing Equipment, Machinery and Vehicles : Mechanical Installing, Maintaining and Repairing', 'Building : Installing Building Interior Infrastructure', 'Analysis : Inspecting and Testing', 'Analysis : Examining and Diagnosing', 'Analysis : Analyzing Information', 'Information Handling : Processing Information']","['Engineering and Technology : Mechanics and Machinery', 'Engineering and Technology : Electricity (Electrical and Electronics)', 'Law and Public Safety : Public Safety and Security']"
