noc,expertise,skills,knowledge
NOC 9231,"['Co-ordinate and monitor the operation of mineral ore, metal and cement processing production through control panels, computer terminals or other control systems, from a central control room', 'Operate multi-function central process control machinery', 'Observe computer printouts, video monitors and gauges to verify specified processing conditions and to make necessary adjustments', 'Co-ordinate and supervise production crew such as machine and process operators, tenders, assistants and helpers', 'Start-up and shut-down systems']","['Working with Technological Equipment and Machinery : Using Specialized Instrumentation and Equipment', 'Service and Care : Protecting and Enforcing', 'Management : Co-ordinating and Organizing', 'Management : Supervising', 'Analysis : Analyzing Information', 'Information Handling : Processing Information']","['Manufacturing and Production : Processing and Production', 'Mathematics and Science : Chemistry']"
NOC 5125,"['Translate a variety of written material', 'Perform quality control and proofreading', 'Revise and correct translated material', 'Maintain the content, context and style of the original material', 'Manage, update and circulate linguistic information', 'Identify the terminology used in a field of activity', 'Conduct terminological research on a given subject or in response to inquiries', 'Provide consultative services to translators, interpreters and technical writers', 'Provide interpretation services in court', 'Interpret oral communication from one language to another aloud or using electronic equipment', 'Translate sign language to a spoken language and vice versa']","['Management : Supervising', 'Analysis : Analyzing Information', 'Analysis : Researching and Investigating', 'Communication : Advising and Consulting', 'Communication : Professional Communicating', 'Communication : Teaching and Training', 'Information Handling : Managing Information', 'Information Handling : Processing Information', 'Creative Expression : Writing']","['Social Sciences and Arts : Languages (English and French)', 'Social Sciences and Arts : Languages Foreign']"
NOC 6332,"['Prepare dough for pies, bread, rolls and sweet goods, batters for muffins, cookies and cakes and icings and frostings according to recipes or special customer orders', 'Bake mixed dough and batters', 'Prepare special orders', 'Frost and decorate cakes and baked goods', 'Draw up production schedules', 'Ensure that the quality of products meets established standards', 'Inspect kitchen and food service areas', 'Operate machinery']","['Service and Care : Cooking, Preparing, Serving', 'Operating and Repairing Equipment, Machinery and Vehicles : Operating Stationary Industrial Equipment', 'Management : Recruiting and Hiring', 'Management : Supervising', 'Analysis : Analyzing Information', 'Analysis : Planning', 'Communication : Teaching and Training', 'Information Handling : Processing Information', 'Creative Expression : Designing']","['Business, Finance and Management : Client  Service', 'Business, Finance and Management : Sales', 'Manufacturing and Production : Food Production and Agriculture', 'Manufacturing and Production : Processing and Production', 'Mathematics and Science : Chemistry']"
NOC 6411,"['Prepare or oversee preparation of sales or other contracts', 'Represent companies that export and import products or services to and from foreign countries', 'Conduct sales transactions', 'Supervise activities of other sales representatives', 'Estimate or quote prices, credit or contract terms, warranties and delivery dates', 'Identify and solicit potential clients', 'Consult with clients after sale or signed contracts', 'Review and adapt information regarding product innovations, competitors and market conditions', 'Provide clients with presentations on the benefits and uses of goods or services', 'Provide customer service', 'Advertise and/or promote products, sales or services']","['Management : Supervising', 'Analysis : Projecting Outcomes', 'Communication : Advising and Consulting', 'Communication : Liaising and Networking', 'Communication : Professional Communicating', 'Communication : Promoting and Selling', 'Information Handling : Processing Information']","['Business, Finance and Management : Client  Service', 'Business, Finance and Management : Marketing', 'Business, Finance and Management : Sales', 'Social Sciences and Arts : Languages Foreign']"
NOC 2131,"['Develop construction specifications and procedures', 'Conduct technical analyses of survey and field data for development of topographic, soil, hydrological or other information and prepare reports', 'Conduct feasibility studies, economic analyses, municipal and regional traffic studies, environmental impact studies or other investigations', 'Monitor air, water and soil quality and develop procedures to clean up contaminated sites', 'Establish and monitor construction work schedules', 'Prepare contract documents and review and evaluate tenders for construction projects', 'Plan and design major civil projects such as buildings, roads, bridges, dams, water and waste management systems and structural steel fabrications', 'Interpret, review and approve survey and civil design work', 'Act as project or site supervisor for land survey or construction work', 'Conduct field services for civil works', 'Confer with clients and other members of the engineering team and conduct research to determine project requirements', 'Ensure construction plans meet guidelines and specifications of building codes and other regulations', 'Supervise technicians, technologists and other engineers and review and approve designs, calculations and cost estimates', 'Evaluate and recommend appropriate building and construction materials']","['Management : Co-ordinating and Organizing', 'Management : Supervising', 'Analysis : Inspecting and Testing', 'Analysis : Planning', 'Analysis : Projecting Outcomes', 'Analysis : Analyzing Information', 'Analysis : Researching and Investigating', 'Communication : Professional Communicating', 'Communication : Advising and Consulting', 'Creative Expression : Designing', 'Creative Expression : Writing']","['Engineering and Technology : Building and Construction', 'Engineering and Technology : Design', 'Engineering and Technology : Engineering and Applied Technologies', 'Law and Public Safety : Public Safety and Security', 'Mathematics and Science : Earth Sciences (Geosciences)']"
NOC 2141,"['Plan and design plant layouts and facilities', 'Develop flexible or integrated manufacturing systems and procedures', 'Conduct studies and implement programs to determine optimum inventory levels and optimum utilization of machinery, materials and resources', 'Analyze costs of production', 'Design and conduct time studies and work simplification programs', 'Conduct studies on the reliability and performance of plant facilities', 'Assess industrial facilities', 'Establish programs and conduct studies to enhance industrial health and safety or to identify and correct fire and other hazards', 'Develop performance standards, evaluation systems and wage and incentive programs', 'Develop maintenance standards, schedules and programs']","['Working with Technological Equipment and Machinery : Installing and Setting-Up Technical Infrastructure', 'Working with Technological Equipment and Machinery : Using Specialized Instrumentation and Equipment', 'Management : Evaluating', 'Management : Supervising', 'Analysis : Analyzing Information', 'Analysis : Planning', 'Analysis : Projecting Outcomes', 'Communication : Professional Communicating', 'Creative Expression : Designing']","['Education and Training : Teaching and Instruction', 'Engineering and Technology : Design', 'Engineering and Technology : Engineering and Applied Technologies', 'Engineering and Technology : Mechanics and Machinery', 'Law and Public Safety : Public Safety and Security', 'Manufacturing and Production : Processing and Production', 'Mathematics and Science : Statistics']"
NOC 2144,"['Plan, develop and co-ordinate programs of geotechnical, geological, geophysical or geohydrological data acquisition, analysis and mapping', 'Prepare recommendations and reports for the construction or improvement of civil engineering projects', 'Conduct studies of groundwater flow and contamination', 'Plan, develop and conduct studies in mining exploration, mine evaluation and feasibility studies', 'Conduct surveys and studies of ore deposits and mine design', 'Design, develop and implement computer applications for geophysics, geochemistry, geology and mapping', 'Analyze reports and prepare recommendations on settlement of buildings, stability of slopes, and effects of earthquakes to support construction and civil engineering projects']","['Working with Technological Equipment and Machinery : Using Specialized Instrumentation and Equipment', 'Management : Co-ordinating and Organizing', 'Management : Supervising', 'Analysis : Planning', 'Analysis : Projecting Outcomes', 'Analysis : Analyzing Information', 'Analysis : Researching and Investigating', 'Communication : Professional Communicating', 'Communication : Advising and Consulting', 'Information Handling : Managing Information']","['Engineering and Technology : Computer and Information Systems', 'Engineering and Technology : Design', 'Engineering and Technology : Engineering and Applied Technologies', 'Mathematics and Science : Earth Sciences (Geosciences)']"
NOC 2153,"['Compile and analyze data on factors affecting land use', 'Confer with appropriate authorities and interest groups to formulate and develop land use or community plans', 'Prepare and recommend land development concepts and plans for zoning, subdivisions, transportation, public utilities, community facilities, parks, agricultural and other land uses', 'Prepare plans for environmental protection', 'Present plans to civic, rural and regional authorities and hold public meetings', 'Review and evaluate proposals for land use and development plans and prepare recommendations', 'Process application for land development permits', 'Administer land use plans and zoning by-laws', 'Formulate long-range objectives and policies relative to future land use and the protection of the environment']","['Service and Care : Protecting and Enforcing', 'Management : Co-ordinating and Organizing', 'Management : Supervising', 'Analysis : Projecting Outcomes', 'Analysis : Analyzing Information', 'Analysis : Researching and Investigating', 'Communication : Liaising and Networking', 'Communication : Professional Communicating', 'Communication : Advising and Consulting', 'Communication : Promoting and Selling', 'Communication : Negotiating and Adjudicating', 'Information Handling : Processing Information', 'Creative Expression : Writing']","['Engineering and Technology : Design', 'Engineering and Technology : Engineering and Applied Technologies', 'Law and Public Safety : Law, Government, and Jurisprudence', 'Law and Public Safety : Public Safety and Security', 'Social Sciences and Arts : Geography']"
NOC 2171,"['Confer with clients to identify and document requirements', 'Conduct business and technical studies', 'Design, develop and implement information systems business solutions', 'Provide advice on information systems strategy, policy, management and service delivery', 'Assess physical and technical security risks to data, software and hardware', 'Develop policies, procedures and contingency plans to minimize the effects of security breaches', 'Develop and implement policies and procedures throughout the software development life cycle', 'Conduct reviews to assess quality assurance practices, software products and information systems']","['Management : Evaluating', 'Analysis : Analyzing Information', 'Analysis : Planning', 'Analysis : Projecting Outcomes', 'Communication : Advising and Consulting', 'Communication : Liaising and Networking', 'Communication : Professional Communicating', 'Information Handling : Managing Information', 'Information Handling : Processing Information']","['Business, Finance and Management : Business  Administration', 'Engineering and Technology : Computer and Information Systems', 'Law and Public Safety : Public Safety and Security']"
NOC 2174,"['Write, modify, integrate and test software code', 'Maintain existing computer programs by making modifications as required', 'Identify and communicate technical problems, processes and solutions', 'Prepare reports, manuals and other documentation on the status, operation and maintenance of software', ""Assist in the collection and documentation of user's requirements"", 'Assist in the development of logical and physical specifications', 'Research and evaluate a variety of software products', 'Program animation software to predefined specifications for interactive CDs, DVDs, video game cartridges and Internet-based applications', 'Program special effects software for film and video applications', 'Write, modify, integrate and test software code for e-commerce and other Internet applications']","['Working with Technological Equipment and Machinery : Debugging and Reprogramming Technical Systems', 'Working with Technological Equipment and Machinery : Installing and Setting-Up Technical Infrastructure', 'Management : Co-ordinating and Organizing', 'Management : Supervising', 'Analysis : Analyzing Information', 'Analysis : Inspecting and Testing', 'Analysis : Planning', 'Analysis : Researching and Investigating', 'Creative Expression : Designing', 'Creative Expression : Writing']","['Engineering and Technology : Computer and Information Systems', 'Engineering and Technology : Design']"
NOC 2225,"['Build models', 'Manage landscaping projects', 'Prepare conceptual designs', 'Prepare presentation graphics and drawings', 'Survey and assess designated sites', 'Apply various treatments such as pruning, spraying, repairing damaged areas and injecting with treatment solutions', 'Assess the health of lawns', 'Direct crews who maintain the health and appearance of golf courses and their surrounding landscapes', 'Plan and co-ordinate the growth and use of plants for landscaping, ornamental uses and other purposes', 'Plan and construct landscaped environments which may include trees, shrubberies, lawns, fences, decks, patios and other landscape structures', 'Examine trees and shrubs to diagnose problems and disease', 'Plant and move trees', 'Plant and maintain private and public lawns and gardens', 'Apply fertilizers, fungicides, herbicides, pesticides and other lawn care products']","['Service and Care : Serving Others', 'Management : Co-ordinating and Organizing', 'Management : Supervising', 'Building : Constructing', 'Analysis : Analyzing Information', 'Analysis : Examining and Diagnosing', 'Analysis : Planning', 'Communication : Advising and Consulting', 'Creative Expression : Designing']","['Engineering and Technology : Building and Construction', 'Engineering and Technology : Design', 'Mathematics and Science : Biology', 'Mathematics and Science : Earth Sciences (Geosciences)']"
NOC 2233,"['Develop and conduct production, inventory and quality assurance programs', 'Design plant layouts and production facilities', 'Develop and carry out work study', 'Conduct work measurement or other studies', 'Develop and carry out health, safety and fire prevention plans', 'Conduct safety training programs', 'Develop computer applications for machines and processes', 'Collect and compile operational or experimental data', 'Collect and analyze data and samples', 'Develop manufacturing and processing procedures', 'Set machine or equipment controls, oversee production and inspect processes', 'Assist in preparing  estimates, schedules, specifications and reports', 'Read blueprints and drawings']","['Working with Technological Equipment and Machinery : Using Specialized Instrumentation and Equipment', 'Service and Care : Protecting and Enforcing', 'Management : Evaluating', 'Analysis : Analyzing Information', 'Analysis : Planning', 'Analysis : Projecting Outcomes', 'Analysis : Researching and Investigating', 'Communication : Advising and Consulting', 'Communication : Teaching and Training', 'Information Handling : Processing Information', 'Creative Expression : Designing']","['Engineering and Technology : Design', 'Engineering and Technology : Engineering and Applied Technologies', 'Engineering and Technology : Mechanics and Machinery', 'Law and Public Safety : Public Safety and Security', 'Manufacturing and Production : Processing and Production']"
NOC 2243,"['Inspect and test operation of instruments and systems', 'Repair and adjust system components', 'Remove and replace defective parts', 'Calibrate components and instruments', 'Determine testing and maintenance procedures', 'Install new measuring instruments']","['Working with Technological Equipment and Machinery : Debugging and Reprogramming Technical Systems', 'Working with Technological Equipment and Machinery : Installing and Setting-Up Technical Infrastructure', 'Working with Technological Equipment and Machinery : Using Specialized Instrumentation and Equipment', 'Operating and Repairing Equipment, Machinery and Vehicles : Mechanical Installing, Maintaining and Repairing', 'Operating and Repairing Equipment, Machinery and Vehicles : Operating Stationary Industrial Equipment', 'Analysis : Examining and Diagnosing', 'Analysis : Inspecting and Testing', 'Communication : Advising and Consulting']","['Engineering and Technology : Electricity (Electrical and Electronics)', 'Engineering and Technology : Mechanics and Machinery', 'Manufacturing and Production : Processing and Production']"
NOC 2263,"['Investigate outbreaks of diseases and food poisoning', 'Conduct surveys and monitoring programs of the natural environment', 'Collect samples of materials for analysis', 'Inspect spills of hazardous chemicals or products', 'Inspect workplaces for safety or health hazards', 'Investigate workplace accidents or illnesses', 'Initiate enforcement procedures to fine or close an establishment', 'Ensure health and safety regulations are followed', 'Inspect products and processing methods; prepare reports and ensure that regulations governing health, quality and safety are followed', 'Develop and implement health and safety plans']","['Service and Care : Protecting and Enforcing', 'Management : Evaluating', 'Analysis : Inspecting and Testing', 'Analysis : Planning', 'Analysis : Analyzing Information', 'Analysis : Researching and Investigating', 'Communication : Advising and Consulting', 'Communication : Teaching and Training', 'Information Handling : Processing Information']","['Law and Public Safety : Public Safety and Security', 'Mathematics and Science : Biology', 'Mathematics and Science : Chemistry']"
NOC 2272,"['Authorize airline flights over assigned routes', 'Co-sign flight authorization with aircraft captain', 'Delay or cancel flight if conditions warrant', 'Prepare and maintain flight plans, flight logs and other reports', 'Analyze environmental conditions and assess load and fuel capacity', 'Brief flight crew before takeoff', 'Provide pilots with information essential to aviation safety', 'Support air traffic control operations', 'Check flight plans for completeness and accuracy', 'Observe, record and transmit atmospheric and weather information', 'Alert airport emergency services when necessary', 'Respond to radio calls from aircraft preparing for takeoff or landing and supply information such as weather conditions, wind speed and direction and presence of local air traffic', 'Direct air traffic within assigned air space', 'Control moving aircraft and service vehicles at airport', 'Relay information to pilots in flight', 'Maintain radio and telephone contact with other control centres', 'Alert airport emergency services when necessary']","['Working with Technological Equipment and Machinery : Using Specialized Instrumentation and Equipment', 'Service and Care : Protecting and Enforcing', 'Service and Care : Serving Others', 'Management : Co-ordinating and Organizing', 'Analysis : Analyzing Information', 'Analysis : Planning', 'Communication : Professional Communicating', 'Information Handling : Processing Information']","['Communications and Transportation : Transportation', 'Law and Public Safety : Public Safety and Security', 'Mathematics and Science : Earth Sciences (Geosciences)', 'Social Sciences and Arts : Geography']"
NOC 3125,"['Treat patients using braces, casts, shields, orthotic devices, physical therapy, or prescribed medications', 'Perform surgery on the bones of the forefoot and the subcutaneous soft tissues of the foot', 'Diagnose diseases, deformities and injuries of the human foot and communicate diagnoses to patients', 'Treat patients using braces, casts, shields, orthotic devices, physical therapy and subcutaneous soft-tissue foot surgery', 'Diagnose diseases, deformities and injuries of the human foot', ""Diagnose patients' diseases and disorders"", 'Employ other methods of healing such as herbal medicines, biochemical therapy, clinical nutrition, homeopathy and counselling in their treatment', 'Employ natural methods of healing such as acupuncture and acupressure, spinal manipulation, reflexology and hydrotherapy', 'Diagnose disorders and injuries of the musculo-skeletal, circulatory and nervous systems', 'Treat patients with manipulative therapy, medications or surgery', 'Prescribe treatment such as eye exercises or patching regimens', 'Work alongside ophthalmologists in the diagnosis and treatment of eye disorders by performing specialized eye tests to measure and assess defective binocular vision or abnormal eye movement in patients']","['Working with Technological Equipment and Machinery : Using Specialized Instrumentation and Equipment', 'Service and Care : Treating People/Animals', 'Analysis : Examining and Diagnosing', 'Analysis : Projecting Outcomes', 'Communication : Advising and Consulting', 'Communication : Interviewing', 'Communication : Liaising and Networking', 'Communication : Professional Communicating', 'Information Handling : Processing Information']","['Business, Finance and Management : Business  Administration', 'Business, Finance and Management : Client  Service', 'Health Services : Medicine', 'Health Services : Therapy and Counselling', 'Mathematics and Science : Biology']"
NOC 3141,"['Conduct research related to hearing and hearing disorders', 'Develop and administer audiometric tests and examinations', 'Diagnose and evaluate the degree and type of hearing impairment', 'Establish personalized care plans working as a member of an interdisciplinary team', 'Plan and implement habilitation/rehabilitation programs', 'Provide information to patients and families regarding the nature, extent, impact and implications of hearing loss and treatment', 'Administer tests and examinations and observe patients to diagnose and evaluate speech, voice, resonance, language, cognitive-linguistic and swallowing disorders', 'Develop, plan and implement remedial programs to correct speech, voice, language, resonance, cognitive-linguistic and swallowing disorders', 'Establish group and personalized care plans working as a member of an interdisciplinary team', 'Conduct research on speech and other communication disorders and on the development and design of diagnostic procedures and devices', 'Provide advice and educational services to patients and families regarding communication and swallowing disorders']","['Working with Technological Equipment and Machinery : Using Specialized Instrumentation and Equipment', 'Service and Care : Treating People/Animals', 'Management : Evaluating', 'Analysis : Examining and Diagnosing', 'Analysis : Planning', 'Analysis : Researching and Investigating', 'Communication : Advising and Consulting', 'Communication : Interviewing', 'Communication : Liaising and Networking', 'Communication : Teaching and Training', 'Information Handling : Processing Information']","['Business, Finance and Management : Business  Administration', 'Business, Finance and Management : Client  Service', 'Health Services : Medicine', 'Health Services : Therapy and Counselling', 'Mathematics and Science : Biology']"
NOC 3144,"[""Interview patients and review reports from health care professionals to determine patients' current and potential functioning levels"", 'Prepare a treatment plan for each patient', 'Implement treatment plans', 'Observe and analyze patients during treatment sessions', 'Record observations, write progress reports and consult with other health care professionals to evaluate treatment plans', 'Initiate, design and implement specialized therapy programs', 'Conduct research in the field of specialization', 'Design specialized therapy programs to maintain, rehabilitate or enhance movement, musculoskeletal functioning and performance in sports, work and recreation']","['Service and Care : Counselling and Nurturing', 'Service and Care : Treating People/Animals', 'Management : Evaluating', 'Analysis : Analyzing Information', 'Analysis : Planning', 'Analysis : Projecting Outcomes', 'Analysis : Researching and Investigating', 'Communication : Interviewing', 'Communication : Liaising and Networking', 'Communication : Teaching and Training', 'Information Handling : Processing Information', 'Creative Expression : Performing and Entertaining', 'Creative Expression : Writing']","['Business, Finance and Management : Business  Administration', 'Business, Finance and Management : Client  Service', 'Health Services : Therapy and Counselling', 'Social Sciences and Arts : Fine and Applied Arts', 'Social Sciences and Arts : Psychology']"
