noc,description,duties,titles,related_occupations
NOC 6344,"Jewellers and workers in related occupations fabricate, assemble, repair and appraise fine jewellery. Watch repairers and related workers repair, clean, adjust and fabricate parts for clocks and watches. They are employed by jewellery, clock and watch manufacturers and retail stores, by jewellery and watch repair shops or they may be self-employed.","['Jewellers and related workers', 'Fabricate and repair precious and semi-precious metal jewellery, such as rings, brooches, pendants, bracelets and lockets', 'Examine, cut, shape and polish diamonds using optical instruments, lathes and laps', 'Examine, cut, shape and polish precious and synthetic gems using optical instruments, cutting disks and laps', 'Appraise gemstones and diamonds to differentiate between stones, identify rare specimens and to detect peculiarity affecting stone values', 'Set precious and semi-precious stones in jewellery mountings, according to specifications', 'May supervise other jewellers.', 'Jewellers may specialize in certain kinds of jewellery, such as gold or silver, or in particular operations, such as fabrication or repair.', 'Watch repairers', 'Fabricate or fit parts to make watches and clocks', 'Examine clocks and watches, disassemble and check for defective and misaligned parts or rust', 'Replace or repair worn or broken parts', 'Test, adjust and regulate timepiece movements', 'Clean all parts using special cleaning and rinsing solutions and ultrasonic or mechanical cleaning machines to remove dirt and dried lubricants', 'May supervise other watch repairers.']","['watch repairer', 'diamond cutter', 'gem cutter', 'gemologist', 'precious stone setter', 'clock repairer', 'pearl cutter']","['Artisans and craftspersons', 'Other products assemblers, finishers and inspectors']"
NOC 7373,"Water well drillers operate a variety of mobile water well drilling rigs and equipment to drill and monitor residential, commercial and industrial water wells. They are employed by water well drilling contractors and governments, or they may be self-employed.","['Review client requirements and proposed locations for water wells', 'Operate water well drilling rigs and other equipment to drill, bore and dig for residential, commercial and industrial water wells or environmental assessment, and install well screens, casings and other well fixtures', 'Document geological formations encountered', 'Clean and disinfect wells in preparation for use', 'Perform routine mechanical maintenance work on water well drilling rigs and equipment', 'Install, test, maintain and repair water well pumps, piping systems and equipment and perform pumping tests to assess well  performance', 'May provide other drilling services, such as repair or dismantling of existing water well structure, elevator shaft drilling and hydro pole drilling.', 'Water well drillers may specialize in a specific method of drilling, such as cable, rotary, auger, hammer or reverse circulation drilling.']","['water well driller apprentice', 'cable tool driller - water well drilling', 'churn drill operator - water well drilling', 'water well driller']","['Drillers and blasters - surface mining, quarrying and construction', 'Underground production and development miners', 'Contractors and supervisors, heavy equipment operator crews', 'Oil and gas well drillers, servicers, testers and related workers']"
NOC 7384,"Workers in other skilled trades occupations repair, service, install, calibrate or fabricate a variety of products, not elsewhere classified. This unit group also includes commercial divers. They are employed by a wide range of establishments, or they may be self-employed.","['Gunsmiths', ""Fabricate guns and repair and modify firearms according to blueprints or customers' specifications."", 'Locksmiths', 'Repair, install and adjust locks, make keys and change lock combinations.', 'Recreation vehicle technicians', 'Repair or replace electrical wiring, plumbing, propane gas lines, appliances, windows, doors, cabinets and structural frames in recreational vehicles.', 'Safe and vault servicers', 'Install, repair and maintain safes and vaults in banks and other establishments.', 'Saw fitters', 'Repair, set and sharpen band saws, chain saws, circular saws and other types of saw blades according to specifications.', 'Die setters', 'Select dies for forging according to work order and specifications; position align and bolt dies to ram and anvil of power presses and hammers.', 'Commercial divers', 'Perform underwater activities related to construction, inspection, search, salvage, repair and photography.']","['explosive ordnance detector', 'restoration steeplejack', 'reclamation diver', 'vault repairer', 'safe maker', 'aircraft patternmaker', 'blacksmith', 'die setter', 'toolsmith', 'commercial diver', 'underwater contractor', 'locksmith', 'saw fitter', 'small arms repairer', 'recreation vehicle technician', 'gunsmith', 'farrier']","['Motorcycle, all-terrain vehicle and other related mechanics', 'Police officers (except commissioned)', 'Other small engine and small equipment repairers', 'Welders and related machine operators']"
NOC 7521,"Heavy equipment operators operate heavy equipment used in the construction and maintenance of roads, bridges, airports, gas and oil pipelines, tunnels, buildings and other structures; in surface mining and quarrying activities; and in material handling work. They are employed by construction companies, heavy equipment contractors, public works departments and pipeline, logging, cargo-handling and other companies.","['Operate heavy equipment such as backhoes, bulldozers, loaders and graders to excavate, move, load and grade earth, rock, gravel or other materials during construction and related activities', 'Operate bulldozers or other heavy equipment to clear brush and stumps prior to logging activities and to build roads at logging and surface mining sites', 'Operate heavy equipment with pile driver head to drive piling into earth to provide support for buildings, bridges or other structures', 'Operate heavy dredging equipment to deepen waterways or reclaim earth fill', 'Operate heavy paving and surfacing equipment to lay, spread or compact concrete, asphalt and other surface materials during highway and road construction', 'Operate power shovels to excavate rock, ore or other materials from open-pit mines, strip mines, quarries or construction pits', 'Operate heavy equipment to move, load and unload cargo', 'Conduct pre-operational checks on equipment and clean, lubricate and refill equipment.']","['backhoe operator', 'bulldozer operator', 'heavy equipment operator', 'excavator operator', 'gradall operator', 'grader operator', 'heavy equipment operator apprentice', 'loader operator - construction', 'side boom tractor operator', 'surface mining equipment operator']","['Crane operators', 'Underground production and development miners', 'Contractors and supervisors, heavy equipment operator crews', 'Material handlers', 'Logging machinery operators']"
NOC 7444,"Pest controllers and fumigators inspect buildings and outside areas for pest infestation and spray chemical treatments to kill noxious and destructive insects, rodents and other pests or set cage traps to capture and remove animals. They are employed by pest control companies, or they may be self-employed.","['Inspect buildings and outside areas at regular intervals or at specific request of property owner to detect signs of infestation', 'Determine type of treatment required and provide estimate of costs to clients', 'Prepare and spray chemical mixture on infested areas using mechanical or electric sprayer to kill insects, rodents and other pests', 'Fumigate households', 'Place and set traps to capture and remove animals, such as skunks or raccoons', 'Install animal control barriers such as needle strips, netting and other devices to keep animals off property', 'Clean out areas that harbour pests using rakes, shovels, brooms or mops', 'Advise clients on how to prevent pest infestation.']","['pest exterminator', 'pest control service representative', 'animal control trapper', 'fumigator, pests', 'pest control operator', 'pest control technician', 'pest controller']","['Contractors and supervisors, other construction trades, installers, repairers and servicers']"
NOC 7452,"Material handlers handle, move, load and unload materials by hand or using a variety of material handling equipment. They are employed by transportation, storage and moving companies, and by a variety of manufacturing and processing companies and retail and wholesale warehouses.","['Material handlers (manual)', 'Load, unload and move products and materials by hand or using basic material handling equipment', 'Move household appliances and furniture onto and off moving trucks or vans', 'Perform other material handling activities such as counting, weighing, sorting, packing and unpacking.', 'Material handlers (equipment operators)', 'Operate winches and other loading devices to load and unload materials onto and off trucks, railway cars and loading docks of warehouses and industrial establishments', 'Operate industrial trucks, tractors, loaders and other equipment to transport materials to and from transportation vehicles and loading docks and to store and retrieve materials in warehouses', 'Connect hoses or pipes and operate equipment to load and unload liquid petroleum, chemical or other products into or from tank cars, tank trucks or storage tanks', 'Operate equipment to dump materials such as coal, ore and grain into or to remove materials from railway cars, trucks or other vehicles', 'Operate conveyors and equipment to transfer grain or other materials from transportation vehicles to elevators, bins or other storage areas', 'May perform other activities, such as opening containers and crates, filling warehouse orders, assisting in taking inventory and weighing and checking materials.']","['bin filler', 'railway car loader', 'coal handler', 'conveyor console operator', 'forklift truck operator', 'freight handler (except air transport)', 'furniture mover', 'material handler', 'lumber piler - building supplies', 'stockpiler', 'warehouseman/woman', 'storage worker - material handling', 'truck loader']","['Supervisors, supply chain, tracking and scheduling co-ordination occupations', 'Air transport ramp attendants', 'Longshore workers', 'Railway and motor transport labourers', 'Heavy equipment operators (except crane)', 'Contractors and supervisors, heavy equipment operator crews', 'Storekeepers and partspersons']"
NOC 1512,"Letter carriers sort and deliver mail, record delivery of registered mail and collect money for cash-on-delivery parcels. They are employed by Canada Post Corporation.","['Organize mail by address and load into mailbag', 'Deliver letters, small parcels and other printed matter along established routes', 'Deliver telegrams, special delivery and express mail', 'Collect payment for cash-on-delivery service', 'Record delivery of registered mail', 'Leave notices indicating that items could not be delivered and the location where they can be picked up', 'Return undeliverable mail to postal station.']","['rural mail carrier', 'letter carrier', 'postman/woman']","['Supervisors, mail and message distribution occupations', 'Mail, postal and related workers', 'Couriers, messengers and door-to-door distributors']"
NOC 1521,"Shippers and receivers ship, receive and record the movement of parts, supplies, materials, equipment and stock to and from an establishment. They are employed in the public sector and by retail and wholesale establishments, manufacturing companies, and other commercial and industrial establishments.","['Determine method of shipment and arrange shipping; prepare bills of lading, customs forms, invoices and other shipping documents manually or by computer', 'Assemble containers and crates, record contents manually or by computer, pack goods to be shipped and affix identifying information and shipping instructions', 'Oversee loading and unloading of goods from trucks or other conveyances', 'Inspect and verify incoming goods against invoices or other documents, record shortages and reject damaged goods', 'Unpack, code and route goods to appropriate storage areas', 'Maintain internal, manual or computerized record-keeping systems', 'May operate forklift, hand truck or other equipment to load, unload, transport and store goods.']","['import freight clerk', 'shipper-receiver', 'receiver', 'freight receiver', 'freight shipper', 'shipper', 'shipping agent', 'shipping and receiving clerk', 'supply chain assistant']","['Supervisors, supply chain, tracking and scheduling co-ordination occupations', 'Correspondence, publication and regulatory clerks', 'Purchasing and inventory control workers', 'Material handlers', 'Storekeepers and partspersons']"
NOC 1524,"Purchasing and inventory control workers process purchasing transactions and maintain inventories of materials, equipment and stock. They are employed by retail and wholesale establishments, manufacturing companies, government agencies and other establishments.","['Purchasing control workers', 'Review requisition orders for accuracy and verify that materials, equipment and stock are not available from current inventories', 'Source and obtain price quotations from catalogues and suppliers and prepare purchase orders', 'Calculate cost of orders and charge or forward invoices to appropriate accounts', 'Process purchases within purchasing authority', 'Contact suppliers to schedule deliveries and to resolve shortages, missed deliveries and other problems', 'Prepare and maintain purchasing files, reports and price lists.', 'Inventory control workers', 'Monitor inventory levels as materials, equipment and stock are issued, transferred within an establishment or sold to the public using manual or computerized inventory systems', 'Compile inventory reports, recording the quantity, type and value of materials, equipment and stock on hand, using manual or computerized inventory systems', 'Prepare requisition orders to replenish materials, equipment and stock', 'Maintain stock rotation and dispose of and account for outdated stock', 'Enter data for production scheduling, stock replenishment/relocation and inventory adjustments', 'Reconcile physical inventories with computer counts.']","['inventory clerk', 'inventory control clerk', 'procurement clerk', 'purchasing clerk', 'purchasing clerk assistant', 'inventory analyst', 'inventory planner']","['Supervisors, supply chain, tracking and scheduling co-ordination occupations', 'Purchasing agents and officers', 'Retail and wholesale buyers', 'Storekeepers and partspersons']"
NOC 1526,"Transportation route and crew schedulers prepare operational and crew schedules for transportation equipment and operating personnel. They are employed by municipal transit commissions, truck, delivery and courier companies, railways, airlines and by other transportation establishments in both the private and public sectors.","['Review schedule requisitions, passenger counts and cargo, running times, distances, personnel availability and other pertinent information to establish schedule parameters', 'Design new or modify existing schedules using computer software or other methods', 'Incorporate into route plan factors such as peak travel periods, holidays, special events and construction with emphasis on time and cost efficiency', 'Assign personnel to equipment and routes and schedule work shifts', 'Compile equipment and personnel records, including hours in service, distances, maintenance, repairs required and other data, to produce operating reports', 'May prepare user guides and other public service information.']","['bus scheduler', 'transit scheduler', 'schedule analyst', 'schedule writer, transportation', 'flight crew scheduler', 'train scheduler', 'truck scheduler', 'crew scheduler - transportation']","['Supervisors, supply chain, tracking and scheduling co-ordination occupations', 'Managers in transportation', 'Production logistics co-ordinators', 'Industrial engineering and manufacturing technologists and technicians']"
NOC 2123,"Agricultural representatives, consultants and specialists provide assistance and advice to farmers on all aspects of farm management, cultivation, fertilization, harvesting, soil erosion and composition, disease prevention, nutrition, crop rotation and marketing. They are employed by businesses, institutions and governments that assist the farming community, or they may be self-employed.","['Provide counselling and advisory services to farmers on crop cultivation and fertilization, harvesting, animal and poultry care, disease prevention, farm management, farm financing, marketing and other agricultural subjects', 'Prepare and conduct advisory information sessions and lectures for farmers and other groups', 'Conduct research, analyze agricultural data and prepare research reports', 'Liaise with researchers, educators and government or business managers on matters pertaining to farming and agriculture', 'Maintain records of services provided and the effects of advice given.', 'Agricultural representatives, consultants and specialists may specialize in specific aspects of agriculture such as animal science, field crops, horticulture, soil science, irrigation or drainage, farm management, marketing, agricultural economics, land use, and environmental management, appraisal or extension and education.']","['field service adviser - agriculture', 'agricultural consultant', 'agricultural extension supervisor', 'agricultural livestock specialist', 'agriculturist', 'consulting agrologist', 'agrologist', 'agronomist', 'crop specialist', 'farm management consultant', 'agricultural soil and crop specialist', 'professional agrologist (P.Ag.)', 'agricultural representative', ""growers' advisor"", 'field service agent - agriculture']","['Biological technologists and technicians', 'Architecture and science managers', 'Biologists and related scientists', 'Other professional engineers, n.e.c.', 'Government managers - economic analysis, policy development and program administration', 'Landscape and horticulture technicians and specialists']"
NOC 9418,"Other metal products machine operators operate one or more automatic or multi-purpose machines to produce a variety of metal parts and products, such as wire mesh, nails, bolts and chains. They are employed by a wide variety of metal products manufacturing companies.","['Operate or tend automatic or multi-purpose machines including wire looms to produce metal parts and metal products such as wire screening, fencing, tinware, metal baskets, racks, hooks, metal tubing and similar articles', 'Fit and assemble components using hand and power tools', 'Clean, polish, file or otherwise finish products', 'Check products for quality and other specifications', 'May clean and lubricate machinery.']","['nail making machine tender', 'spring machine operator', 'wire screen maker', 'wire weaver', 'bolt machine operator', 'bullet maker', 'metal cable maker operator', 'can-forming machine operator', 'chain-making machine operator']","['Machining tool operators', 'Supervisors, other mechanical and metal products manufacturing', 'Metalworking and forging machine operators']"
NOC 9611,"Labourers in mineral and metal processing perform material handling, clean-up, packaging and other elemental activities related to mineral ore and metal processing. They are employed in mineral ore and metal processing plants such as copper, lead and zinc refineries, uranium processing plants, steel mills, aluminum plants, precious metal refineries, cement processing plants, clay, glass and stone processing plants and foundries.","['Transport raw materials, finished products, scrap and recyclable materials throughout plant manually or using forklift or other powered equipment', 'Feed conveyors, crushers and other equipment; open valves and start pumps; skim dross from furnaces; sort, stack, bundle and stamp materials; and perform other activities to assist process and machine operators in mineral ore and metal processing', 'Clean work areas and equipment', 'May assist with minor repairs and maintenance.']","['salt screening labourer', 'glass packer', 'brick and tile kiln cleaner', 'metal pourer helper', 'rolling mill worker - primary metal processing', 'tailings disposal labourer - primary metal processing', 'asbestos worker - mineral processing', 'core shop labourer - foundry', 'extrusion helper - primary metal processing', 'lime kiln operator helper - mineral products processing', 'furnace loader - primary metal and mineral products processing', 'helper, fibreglass oven charger']","['Supervisors, mineral and metal processing', 'Labourers in metal fabrication']"
NOC 3413,"Nurse aides, orderlies and patient service associates assist nurses, hospital staff and physicians in the basic care of patients. They are employed in hospitals, nursing homes, assisted care facilities for the elderly and other health care establishments.","[""Answer call signals; supply and empty bed pans; bathe, dress and groom patients; serve meal trays, feed or assist in feeding of patients and assist patients with menu selection; weigh, lift, turn, and position patients; shave patients prior to operations; supervise patients' exercise routines, set up and provide leisure activities for patients, accompany patients on outside recreational activities and perform other duties related to patient care and comfort"", ""Take patients' blood pressure, temperature and pulse; report or record fluid intake and output; observe or monitor patients' status and document patient care on charts; administer first aid in emergency situations; collect specimens such as urine, faeces or sputum; administer suppositories, colonic irrigations and enemas and perform other procedures as directed by nursing and hospital staff"", 'Transport patients by wheelchair or stretcher for treatment or surgery', 'Carry messages, reports, requisitions and specimens between departments', ""Make beds and maintain patients' rooms"", 'Maintain inventory of supplies', 'May perform maintenance tasks such as assisting with the set-up and maintenance of traction equipment, cleaning or sterilizing equipment, maintaining and repairing equipment, and assembling, setting-up and operating job-related equipment', 'May transport patients between care facilities.']","['personal care attendant - medical', 'emergency medical responder', 'resident care aide - medical', 'health care aide', 'patient care aide', 'psychiatric aide', 'hospital attendant', 'nursing attendant', 'long term care aide', 'nurse aide', 'orderly', 'patient service associate']","['Licensed practical nurses', 'Other assisting occupations in support of health services', 'Home support workers, housekeepers and related occupations']"
NOC 4112,"Lawyers and Quebec notaries advise clients on legal matters, represent clients before administration boards and draw up legal documents such as contracts and wills. Lawyers also plead cases, represent clients before tribunals and conduct prosecutions in courts of law. Lawyers are employed in law firms and prosecutor's offices. Quebec notaries are employed in notary offices. Both lawyers and Quebec notaries are employed by federal, provincial and municipal governments and various business establishments or they may be self-employed. Articling students are included in this unit group.","['Advise clients of their legal rights and all matters related to law', 'Research legal precedents and gather evidence', ""Plead clients' cases before courts of law, tribunals and boards (lawyers only)"", 'Draw up legal documents such as real estate transactions, wills, divorces and contracts, and prepare statements of legal opinions', 'Negotiate settlements of civil disputes (lawyers only)', 'Perform administrative and management functions related to the practice of law', 'May act as mediator, conciliator or arbitrator', 'May act as executor, trustee or guardian in estate and family law matters.', 'Lawyers and Quebec notaries may specialize in specific areas of the law such as criminal law (lawyers only), corporate law, contract law, taxation law, administrative law, international law, commercial law, real estate law, family and estate law, intellectual property law and labour law.']","['articling law student', 'prosecutor', 'legislative counsel', 'legal advisor', 'lawyer', 'corporate counsel', 'Crown attorney', 'law partner', 'notary (Quebec)', 'solicitor']","['Other administrative services managers', 'Other business services managers', 'Natural and applied science policy researchers, consultants and program officers', 'Paralegal and related occupations']"
