noc,expertise,skills,knowledge
NOC 2111,"['Develop or participate in the development of instrumentation and software for astronomical observation and analysis', 'Design and conduct observational surveys, conduct detailed analyses and develop numerical models to extend knowledge of celestial bodies and cosmic radiation', 'Participate as a member of a research or development team in the design and development of experimental, industrial or medical equipment, instrumentation and procedures', 'Design and conduct research in experimental and theoretical physics', 'Carry out analysis of research data and prepare research reports']","['Working with Technological Equipment and Machinery : Using Specialized Instrumentation and Equipment', 'Analysis : Analyzing Information', 'Analysis : Planning', 'Analysis : Researching and Investigating', 'Communication : Advising and Consulting', 'Communication : Professional Communicating', 'Creative Expression : Writing']","['Communications and Transportation : Telecommunications', 'Engineering and Technology : Computer and Information Systems', 'Engineering and Technology : Electricity (Electrical and Electronics)', 'Engineering and Technology : Engineering and Applied Technologies', 'Manufacturing and Production : Processing and Production', 'Mathematics and Science : Earth Sciences (Geosciences)', 'Mathematics and Science : Mathematics', 'Mathematics and Science : Physics']"
NOC 2255,"['Generate maps and related graphs and charts', 'Plan map content, format and design and compile required data from aerial photographs, survey notes, records, reports and other maps', 'Maintain and manage digital database', 'Process data to conduct basic analyses of trends', 'Write specifications and technical reports', 'Monitor for quality', 'Participate in field checks and verification', 'Inspect final compositions', 'Examine and interpret aerial photographs', 'Develop specialized computer software, Internet based GIS, database and business applications', 'Participate in programs to control avalanches in mountainous terrain', 'Perform data entry', 'Operate analog or digital airborne remote sensing equipment to prepare images, data and graphic reports, maps and charts', 'Observe, record and transmit atmospheric and weather information', 'Maintain climatological databases', 'Verify accuracy and completeness of data', 'Analyze and interpret weather data', 'Observe, chart and report on ice conditions in navigable waters']","['Working with Technological Equipment and Machinery : Using Specialized Instrumentation and Equipment', 'Analysis : Analyzing Information', 'Analysis : Planning', 'Communication : Liaising and Networking', 'Communication : Teaching and Training', 'Information Handling : Managing Information', 'Information Handling : Processing Information']","['Engineering and Technology : Computer and Information Systems', 'Engineering and Technology : Design', 'Mathematics and Science : Earth Sciences (Geosciences)', 'Social Sciences and Arts : Geography']"
NOC 2221,"['Analyze data and prepare reports', 'Assist in conducting field research and surveys to collect data and samples', 'Set up and conduct biological, microbiological, biochemical tests and laboratory analyses', 'Assist in analysis of data and preparation of reports', 'Conduct or supervise operational programs', 'Assist in conducting biological, microbiological, biochemical tests and laboratory analyses', 'Conduct field research and surveys to collect data and samples', 'Conduct environmental monitoring and compliance activities for the protection of fisheries stock, wildlife and other natural resources', 'Analyze data and prepare reports', 'Set up and conduct biological, microbiological, biochemical tests and laboratory analyses', 'Conduct or supervise operational programs', 'Conduct field research and surveys to collect data and samples', 'Assist in conducting field research and surveys to collect data and samples', 'Assist in conducting biological, microbiological, biochemical tests and laboratory analyses', 'Assist in analysis of data and preparation of reports']","['Working with Technological Equipment and Machinery : Using Specialized Instrumentation and Equipment', 'Analysis : Analyzing Information', 'Analysis : Inspecting and Testing', 'Analysis : Planning', 'Analysis : Researching and Investigating', 'Information Handling : Processing Information']","['Manufacturing and Production : Food Production and Agriculture', 'Manufacturing and Production : Processing and Production', 'Mathematics and Science : Biology', 'Mathematics and Science : Chemistry']"
NOC 2234,"['Prepare estimates of labour and/or material costs', 'Prepare master format estimates (Class A)', 'Prepare elemental format estimates (Classes B, C, D)', 'Prepare estimates for general expenses and overheads', 'Project cash flow and financing requirements', 'Estimate pre-contract costs', 'Utilize quantity take-off procedures', 'Advise on tendering procedures', 'Analyze tenders and recommend awards', 'Set up cost monitoring and reporting systems', 'Monitor and adjust contract expenditures', 'Prepare and maintain directory of supplies and trade contractors', 'Liaise, consult and communicate with engineers, architects, owners, contractors and subcontractors on changes and adjustments to cost estimates']","['Management : Co-ordinating and Organizing', 'Building : Constructing', 'Analysis : Planning', 'Analysis : Projecting Outcomes', 'Analysis : Analyzing Information', 'Communication : Liaising and Networking', 'Communication : Advising and Consulting', 'Communication : Negotiating and Adjudicating', 'Information Handling : Processing Information']","['Engineering and Technology : Mechanics and Machinery', 'Engineering and Technology : Electricity (Electrical and Electronics)', 'Engineering and Technology : Building and Construction', 'Engineering and Technology : Design', 'Engineering and Technology : Engineering and Applied Technologies']"
NOC 2224,"['Patrol wildlife and environment by truck, aircraft, boat or foot', 'Present evidence in court', 'Assist biologists', 'Check registrations and licences of fishing vessels', 'Inspect fish catch for size', 'Monitor legal fish season', 'Inspect fishing gear and equipment', 'Seize and charge fishing vessels for illegal activities', 'Investigate complaints, arrest violators and prepare briefs', 'Generate public awareness of fish and wildlife conservation and regulation', 'Issue licences, export documents and special permits', 'Perform resources protection duties', 'Supervise or provide firearms safety training courses', 'Supervise or provide trapper education courses']","['Service and Care : Serving Others', 'Service and Care : Protecting and Enforcing', 'Management : Supervising', 'Analysis : Inspecting and Testing', 'Communication : Professional Communicating', 'Communication : Advising and Consulting', 'Communication : Negotiating and Adjudicating', 'Communication : Teaching and Training', 'Information Handling : Processing Information']","['Law and Public Safety : Law, Government, and Jurisprudence', 'Law and Public Safety : Public Safety and Security', 'Mathematics and Science : Biology']"
NOC 4161,"['Conduct research', 'Advise on policies and physical, social and psychological interrelationships between persons, their equipment and environments', 'Ensure products and work methods maximize safety, productivity and comfort', 'Study, evaluate and control physical, chemical, biological and ergonomics hazards and stresses in the workplace and suggest changes to work processes', 'Provide information to workers and managers/employers on methods to reduce the risk of injury or illness', 'Conduct patent searches and prepare patent applications', 'Advise clients on elements of patent law and on the patentability of inventions', 'Represent clients before the patent office', 'Provide consulting services to government and other organizations', 'Prepare research papers, educational texts or articles', 'Establish internal programs within schools, business and industry to promote responsible attitudes towards the environment', 'Provide information to the public through newspaper and magazine columns, articles and radio commentaries', 'Develop or administer programs related to scientific fields', 'Gather and analyze samples of dust, gases, mists and vapors', 'Use direct reading meters to measure levels of light, heat, noise and radiation', 'Evaluate the effectiveness of control equipment which may affect employee health', 'Report and document investigations and conclusions/recommendations', 'Teach safe work procedures and prepare material safety reports', 'Serve as expert witnesses on health issues under litigation', 'Participate in emergency response planning', 'Deliver presentations at conferences, workshops or symposia']","['Management : Evaluating', 'Analysis : Planning', 'Analysis : Projecting Outcomes', 'Analysis : Analyzing Information', 'Analysis : Researching and Investigating', 'Communication : Liaising and Networking', 'Communication : Professional Communicating', 'Communication : Advising and Consulting', 'Communication : Promoting and Selling', 'Communication : Teaching and Training', 'Information Handling : Processing Information', 'Information Handling : Managing Information', 'Creative Expression : Writing']","['Engineering and Technology : Engineering and Applied Technologies', 'Law and Public Safety : Public Safety and Security', 'Mathematics and Science : Biology', 'Mathematics and Science : Chemistry', 'Mathematics and Science : Physics', 'Mathematics and Science : Statistics']"
NOC 414,"['Organize and direct committees and working groups to plan, manage or evaluate projects and programs', 'Direct and advise professional and non-professional staff', 'Plan and manage budgets', 'Participate in the development of policies and programs unique to government', 'Interview, hire and provide training for staff', 'Organize government unit or agency and establish procedures']","['Management : Leading and Motivating', 'Management : Recruiting and Hiring', 'Management : Co-ordinating and Organizing', 'Management : Allocating and Controlling Resources', 'Management : Evaluating', 'Analysis : Planning', 'Analysis : Projecting Outcomes', 'Analysis : Analyzing Information', 'Communication : Liaising and Networking', 'Communication : Interviewing', 'Communication : Professional Communicating', 'Communication : Advising and Consulting', 'Communication : Teaching and Training']","['Business, Finance and Management : Business  Administration', 'Law and Public Safety : Law, Government, and Jurisprudence', 'Social Sciences and Arts : Sociology and Anthropology']"
NOC 3114,"['Diagnose diseases or abnormal conditions in individual animals, herds and flocks through physical examinations or laboratory tests', 'Treat sick or injured animals by prescribing medication, setting bones, dressing wounds or performing surgery', 'Vaccinate animals to prevent and treat diseases', 'Advise clients on feeding, housing, behaviour, breeding, hygiene and general care of animals', 'Perform routine, emergency and post-mortem examinations', 'Provide a range of veterinary services including obstetrics, dentistry and euthanasia']","['Working with Technological Equipment and Machinery : Using Specialized Instrumentation and Equipment', 'Service and Care : Treating People/Animals', 'Management : Supervising', 'Analysis : Examining and Diagnosing', 'Analysis : Projecting Outcomes', 'Communication : Advising and Consulting', 'Communication : Interviewing', 'Communication : Teaching and Training', 'Information Handling : Processing Information']","['Business, Finance and Management : Business  Administration', 'Business, Finance and Management : Client  Service', 'Health Services : Medicine', 'Health Services : Therapy and Counselling', 'Law and Public Safety : Law, Government, and Jurisprudence', 'Law and Public Safety : Public Safety and Security', 'Mathematics and Science : Biology', 'Mathematics and Science : Chemistry']"
NOC 1215,"['Establish work schedules and procedures', 'Co-ordinate activities with other work units or departments', 'Prepare and submit reports', 'Ensure smooth operation of computer equipment and machinery', 'Arrange for maintenance and repair work', 'Resolve work related problems', 'Recruit and hire staff', 'Train workers in duties and policies', 'Arrange training for staff', 'Conduct performance reviews', 'Requisition or order materials, equipment and supplies', 'Co-ordinate, assign and review work', 'Plan, organize and oversee operational logistics of the organization']","['Management : Co-ordinating and Organizing', 'Management : Supervising', 'Analysis : Planning', 'Analysis : Analyzing Information', 'Communication : Teaching and Training', 'Information Handling : Processing Information']","['Business, Finance and Management : Clerical']"
NOC 2212,"['Conduct or direct surveys or survey programs', 'Assist in evaluation and analysis of petroleum and mineral reservoir', 'Prepare or supervise preparation of rock, mineral or metal samples', 'Assist in preparing rock, mineral or metal samples', 'Perform physical and chemical laboratory tests', 'Supervise oil and gas well drilling, well completions and work-overs', 'Conduct or supervise mining studies', 'Prepare notes, sketches, geological maps and cross sections', 'Assist in hydrogeological field and laboratory studies', 'Conduct or assist in environmental audits, in the design of measures to minimize undesirable environmental effects of mining and oil and gas operations']","['Working with Technological Equipment and Machinery : Using Specialized Instrumentation and Equipment', 'Operating and Repairing Equipment, Machinery and Vehicles : Operating Mobile Equipment', 'Management : Supervising', 'Analysis : Analyzing Information', 'Analysis : Planning', 'Analysis : Researching and Investigating', 'Information Handling : Processing Information']","['Engineering and Technology : Engineering and Applied Technologies', 'Manufacturing and Production : Processing and Production', 'Mathematics and Science : Earth Sciences (Geosciences)']"
NOC 1452,"['Process classified ads', 'Write and edit advertising copy', 'Calculate advertising rates and bill customers', 'Proofread data', 'Read newspapers, magazines, press releases and other publications and clip articles to locate and file articles of interest', 'Write routine business and government correspondence', 'Compile and verify material for publication', 'Assist in the preparation of material for publication', 'Perform routine clerical duties', 'Compile, verify, record and process applications, licences, permits, contracts, registrations, requisitions, and other forms and documents', 'Verify facts and conduct research']","['Analysis : Analyzing Information', 'Communication : Professional Communicating', 'Creative Expression : Writing']","['Business, Finance and Management : Clerical', 'Communications and Transportation : Communications and Media', 'Social Sciences and Arts : Languages (English and French)']"
NOC 1434,"['Prepare real estate rentals, sales and listings data', 'Prepare stocks, bonds and securities listings data', 'Sort, verify and process financial transactions', 'Maintain financial information and securities listings', 'Process claims transactions', 'Administer policy changes', 'Collect premium payments', 'Calculate insurance premiums', 'Calculate pension benefits', 'Calculate annuity payments', 'Compile and maintain insurance data and records', 'Compile records of deposit, loan and mortgage payments', 'Process applications for loans and mortgages', 'Prepare RRSP and term deposits', 'Verify and balance transactions', 'Calculate service charges and interest payments', 'Sell drafts, money orders and foreign currency', 'Notify customers regarding account discrepancies']","['Service and Care : Serving Others', 'Information Handling : Processing Information', 'Handling Goods and Materials : Sorting']","['Business, Finance and Management : Accounting', 'Business, Finance and Management : Clerical']"
NOC 1121,"['Plan, develop, implement and evaluate human resources policies and programs', 'Advise managers and employees on the interpretation of human resources policies, benefit programs and collective agreements', 'Negotiate collective agreements on behalf of employers or workers', 'Mediate labour disputes and grievances', 'Research and prepare occupational classifications, job descriptions and salary scales', 'Administer benefit employment equity and other human resources programs', 'Co-ordinate employee performance and appraisal programs', 'Research employee benefits and health and safety practices and recommend changes', 'Hire, train and supervise staff']","['Management : Co-ordinating and Organizing', 'Management : Evaluating', 'Management : Recruiting and Hiring', 'Management : Strategic Planning', 'Analysis : Analyzing Information', 'Analysis : Planning', 'Analysis : Researching and Investigating', 'Communication : Advising and Consulting', 'Communication : Interviewing', 'Communication : Liaising and Networking', 'Communication : Negotiating and Adjudicating', 'Communication : Professional Communicating', 'Information Handling : Managing Information', 'Creative Expression : Writing']","['Business, Finance and Management : Business  Administration', 'Business, Finance and Management : Personnel and Human Resources', 'Education and Training : Teaching and Instruction', 'Social Sciences and Arts : Psychology']"
NOC 1432,"['Prepare and verify statements of earnings for employees, indicating gross and net salaries and deductions such as taxes, union dues, garnishments and insurance and pension plans', 'Prepare and balance period-end reports and reconcile issued payrolls to bank statements', 'Prepare monthly statements', 'Complete, verify and process forms and documentation for administration of benefits such as pension plans, leaves, share savings, employment and medical insurance', 'Inform employees about payroll matters and benefit plans', 'Compile statistics and reports', 'Maintain records of employee attendance, leave and overtime to calculate pay and benefit entitlements, using manual or computerized systems', 'Occupational health and safety', 'Prepare T4 statements and other statements', 'Maintain payroll']","['Service and Care : Serving Others', 'Analysis : Analyzing Information', 'Information Handling : Processing Information']","['Business, Finance and Management : Accounting', 'Business, Finance and Management : Clerical', 'Business, Finance and Management : Client  Service']"
NOC 2114,"['Analyze and interpret data', 'Produce weather forecasts', 'Conduct research of atmospheric phenomena, weather and climate', 'Develop and test mathematical computer profiles of weather and climate', 'Analyze the impact of industrial projects and human activity on the climate and quality of the air', 'Study the effects of weather on the environment', 'Provide consultation and advice', 'Make scientific presentations, publish reports and articles', 'Engage in the design and development of new equipment and procedures for meteorological data collection, remote sensing, or for related applications', 'Disseminate weather forecasts and reports to the general public through a variety of media']","['Working with Technological Equipment and Machinery : Using Specialized Instrumentation and Equipment', 'Analysis : Analyzing Information', 'Analysis : Projecting Outcomes', 'Analysis : Researching and Investigating', 'Communication : Advising and Consulting', 'Communication : Liaising and Networking', 'Communication : Professional Communicating', 'Information Handling : Managing Information', 'Creative Expression : Writing']","['Engineering and Technology : Computer and Information Systems', 'Law and Public Safety : Public Safety and Security', 'Mathematics and Science : Earth Sciences (Geosciences)', 'Mathematics and Science : Mathematics', 'Mathematics and Science : Physics', 'Social Sciences and Arts : Geography']"
NOC 2147,"[""Analyze user's requirements, and design and develop system architecture and specifications"", 'Research, design, develop and integrate computer and telecommunications hardware', 'Develop and conduct design verification simulations and prototype bench tests of components', 'Supervise, inspect and provide design support during the manufacturing, installation and implementation of computer and telecommunications hardware', 'Lead and co-ordinate teams of engineers, technologists, technicians and drafters in the design and development of computer and telecommunications hardware', 'Lead and co-ordinate teams of design professionals in the development and integration of information and communication system architecture, hardware and software', 'Research, design and develop information and communication system network architecture', 'Research, evaluate and integrate network system and data communication hardware and software', 'Assess, document and optimize the capacity and performance of information and communication system networks']","['Working with Technological Equipment and Machinery : Debugging and Reprogramming Technical Systems', 'Working with Technological Equipment and Machinery : Installing and Setting-Up Technical Infrastructure', 'Management : Co-ordinating and Organizing', 'Management : Supervising', 'Analysis : Analyzing Information', 'Analysis : Planning', 'Analysis : Researching and Investigating', 'Communication : Liaising and Networking', 'Communication : Professional Communicating', 'Information Handling : Managing Information', 'Creative Expression : Designing']","['Communications and Transportation : Telecommunications', 'Engineering and Technology : Computer and Information Systems', 'Engineering and Technology : Design', 'Engineering and Technology : Electricity (Electrical and Electronics)', 'Engineering and Technology : Engineering and Applied Technologies', 'Mathematics and Science : Physics']"
NOC 2115,"['Conduct studies into the properties and production of metals and alloys', 'Conduct research into the composition, distribution and evolution of soils', 'Conduct research into the properties, composition and production of materials such as ceramics and composite materials', 'Command, pilot or serve as crew members of a spacecraft to conduct scientific experiments and research', 'Participate in space missions to maintain spacecraft, install and repair space station equipment and launch and recapture satellites']","['Working with Technological Equipment and Machinery : Using Specialized Instrumentation and Equipment', 'Analysis : Analyzing Information', 'Analysis : Planning', 'Analysis : Researching and Investigating', 'Communication : Advising and Consulting', 'Communication : Liaising and Networking', 'Communication : Professional Communicating']","['Engineering and Technology : Engineering and Applied Technologies', 'Manufacturing and Production : Processing and Production', 'Mathematics and Science : Chemistry', 'Mathematics and Science : Earth Sciences (Geosciences)', 'Mathematics and Science : Physics']"
NOC 1225,"['Purchase general and specialized equipment, materials or business services', 'Assess requirements of establishment', 'Develop specifications for equipment, materials and supplies to be purchased', 'Invite tenders', 'Consult with suppliers', 'Review quotations', 'Determine contract terms and conditions', 'Award contracts or recommend contract awards', 'Establish delivery schedules', 'Monitor progress of delivery schedules', 'Contact clients and suppliers to resolve problems']","['Management : Recruiting and Hiring', 'Management : Supervising', 'Analysis : Planning', 'Analysis : Analyzing Information', 'Communication : Liaising and Networking', 'Communication : Interviewing', 'Communication : Negotiating and Adjudicating', 'Communication : Teaching and Training', 'Information Handling : Processing Information']","['Business, Finance and Management : Economics', 'Business, Finance and Management : Finance', 'Business, Finance and Management : Business  Administration', 'Engineering and Technology : Engineering and Applied Technologies']"
NOC 5242,"['Estimate cost of projects and prepare detailed specifications', 'Work with other disciplines', ""Create interior spaces that reflect clients' needs and tastes"", 'Develop plans, elevations, cross sections and detailed drawings', 'Consult with clients to determine needs, preferences, safety requirements and purpose of space', 'Advise on selection of colours, finishes and materials, lighting, furniture and other items, taking into account ergonomic and occupational health standards', 'Develop detailed plans and 3-D models showing arrangement of walls, dividers, displays, lighting and other fixtures']","['Management : Allocating and Controlling Resources', 'Management : Evaluating', 'Management : Supervising', 'Analysis : Planning', 'Analysis : Projecting Outcomes', 'Communication : Advising and Consulting', 'Communication : Liaising and Networking', 'Creative Expression : Designing']","['Business, Finance and Management : Client  Service', 'Engineering and Technology : Building and Construction', 'Engineering and Technology : Computer and Information Systems', 'Engineering and Technology : Design', 'Law and Public Safety : Public Safety and Security', 'Mathematics and Science : Mathematics']"
