noc,expertise,skills,knowledge
NOC 7205,"['Supervise workers and projects', 'Co-ordinate and schedule activities', 'Train or arrange for training', 'Manage own company', 'Set up machines and equipment', 'Recommend personnel actions', 'Ensure health and safety regulations are followed', 'Read blueprints and drawings', 'Requisition or order materials, equipment and supplies']","['Service and Care : Protecting and Enforcing', 'Management : Co-ordinating and Organizing', 'Management : Supervising', 'Analysis : Planning', 'Analysis : Analyzing Information', 'Communication : Advising and Consulting', 'Communication : Teaching and Training', 'Information Handling : Processing Information']","['Business, Finance and Management : Business  Administration', 'Business, Finance and Management : Personnel and Human Resources', 'Engineering and Technology : Mechanics and Machinery', 'Engineering and Technology : Building and Construction', 'Law and Public Safety : Public Safety and Security']"
NOC 7304,"['Supervise workers and projects', 'Ensure health and safety regulations are followed', 'Recommend personnel actions', 'Co-ordinate and schedule activities', 'Resolve work problems and recommend measures to improve productivity', 'Requisition or order materials, equipment and supplies', 'Establish methods to meet work schedules and co-ordinate work activities with other work units', 'Train staff/workers in job duties, safety procedures and company policies']","['Service and Care : Protecting and Enforcing', 'Management : Co-ordinating and Organizing', 'Management : Supervising', 'Analysis : Planning', 'Analysis : Analyzing Information', 'Communication : Advising and Consulting', 'Communication : Teaching and Training', 'Information Handling : Processing Information']","['Business, Finance and Management : Personnel and Human Resources', 'Communications and Transportation : Transportation', 'Law and Public Safety : Public Safety and Security']"
NOC 7305,"['Supervise workers and projects', 'Train or arrange for training', 'Dispatch bus drivers and monitor routes', 'Monitor and operate signal and track switch control panel', 'Ensure health and safety regulations are followed', 'Co-ordinate and schedule activities', 'Recommend personnel actions', 'Requisition or order materials, equipment and supplies', 'Resolve work problems and recommend measures to improve work methods', 'Co-ordinate repairs and rentals']","['Service and Care : Protecting and Enforcing', 'Management : Co-ordinating and Organizing', 'Management : Supervising', 'Analysis : Analyzing Information', 'Analysis : Planning', 'Communication : Advising and Consulting', 'Communication : Teaching and Training', 'Information Handling : Processing Information']","['Business, Finance and Management : Client  Service', 'Business, Finance and Management : Personnel and Human Resources', 'Communications and Transportation : Transportation', 'Law and Public Safety : Public Safety and Security']"
NOC 7232,"['Compute dimensions and tolerances and set up machine tools', 'Verify machined parts for conformance to specifications using precision measuring instruments', 'Machine, fit and assemble castings and other parts to make metal moulds, cores boxes and precision models of required shape', 'Inspect and test final products', 'Set up and operate electrical discharge machines (EDM)', 'Position, secure, measure and work metal stock or castings to lay out for machining', 'Lay out, shape and assemble patterns of metal, wood, plastic and other materials from blueprints, models or templates', 'Set up, operate and maintain a variety of conventional and computer numerically controlled (CNC) machine tools']","['Working with Technological Equipment and Machinery : Installing and Setting-Up Technical Infrastructure', 'Operating and Repairing Equipment, Machinery and Vehicles : Operating Stationary Industrial Equipment', 'Building : Constructing', 'Analysis : Analyzing Information', 'Analysis : Inspecting and Testing', 'Analysis : Planning']","['Engineering and Technology : Building and Construction', 'Engineering and Technology : Computer and Information Systems', 'Engineering and Technology : Mechanics and Machinery', 'Manufacturing and Production : Processing and Production']"
NOC 7243,"['Install and maintain transformers and other power distribution equipment', 'Install and maintain equipment and apparatus in powerhouses', 'Inspect and test electrical equipment and apparatus', 'Troubleshoot and locate faults', 'Repair or replace faulty equipment and apparatus']","['Working with Technological Equipment and Machinery : Installing and Setting-Up Technical Infrastructure', 'Operating and Repairing Equipment, Machinery and Vehicles : Mechanical Installing, Maintaining and Repairing', 'Analysis : Analyzing Information', 'Analysis : Inspecting and Testing', 'Information Handling : Processing Information']","['Engineering and Technology : Electricity (Electrical and Electronics)', 'Engineering and Technology : Mechanics and Machinery', 'Law and Public Safety : Public Safety and Security']"
NOC 7244,"['Install, maintain, troubleshoot and repair electrical distribution and transmission systems', 'Erect and maintain steel, wood or concrete poles, towers and guy wires', 'Splice, solder and insulate conductors and related wiring to connect power distribution and transmission networks', 'Inspect and test overhead and underground power lines and cables and auxiliary equipment', 'Install and maintain street lighting systems', 'Ensure health and safety regulations are followed', 'Communicate with other workers to co-ordinate the preparation and completion of work assignments', 'Work in confined spaces to install power lines and cables and associated equipment', 'Climb ladders or operate hydraulic buckets']","['Working with Technological Equipment and Machinery : Installing and Setting-Up Technical Infrastructure', 'Operating and Repairing Equipment, Machinery and Vehicles : Mechanical Installing, Maintaining and Repairing', 'Operating and Repairing Equipment, Machinery and Vehicles : Operating Mobile Equipment', 'Building : Constructing', 'Analysis : Inspecting and Testing', 'Analysis : Planning', 'Analysis : Examining and Diagnosing', 'Analysis : Analyzing Information']","['Engineering and Technology : Mechanics and Machinery', 'Engineering and Technology : Electricity (Electrical and Electronics)', 'Law and Public Safety : Public Safety and Security']"
NOC 9214,"['Supervise, co-ordinate and schedule activities of production workers who operate processing machines and who fabricate, assemble, finish or inspect plastic or rubber parts and products', 'Establish methods to meet work schedules and co-ordinate work activities with other work units', 'Recommend measures to improve productivity and product quality', 'Set up machines and equipment']","['Service and Care : Protecting and Enforcing', 'Operating and Repairing Equipment, Machinery and Vehicles : Mechanical Installing, Maintaining and Repairing', 'Management : Co-ordinating and Organizing', 'Management : Supervising', 'Analysis : Analyzing Information', 'Analysis : Planning', 'Communication : Advising and Consulting', 'Communication : Teaching and Training', 'Information Handling : Processing Information']","['Business, Finance and Management : Personnel and Human Resources', 'Manufacturing and Production : Processing and Production', 'Mathematics and Science : Chemistry']"
NOC 9221,"['Establish work schedules', 'Oversee safety of operations', 'Supervise, co-ordinate and schedule (and possibly review) activities of workers', 'Train staff/workers in job duties, safety procedures and company policies', 'Requisition or order materials, equipment and supplies', 'Resolve work problems and recommend measures to improve work methods']","['Service and Care : Protecting and Enforcing', 'Management : Co-ordinating and Organizing', 'Management : Supervising', 'Analysis : Analyzing Information', 'Analysis : Planning', 'Communication : Advising and Consulting', 'Communication : Teaching and Training', 'Information Handling : Processing Information']","['Business, Finance and Management : Personnel and Human Resources', 'Engineering and Technology : Engineering and Applied Technologies', 'Engineering and Technology : Mechanics and Machinery', 'Manufacturing and Production : Processing and Production']"
NOC 9224,"['Establish work schedules', 'Oversee safety of operations', 'Supervise, co-ordinate and schedule (and possibly review) activities of workers', 'Resolve work problems and recommend measures to improve productivity', 'Recommend measures to improve productivity and product quality', 'Set up machines and equipment']","['Service and Care : Protecting and Enforcing', 'Management : Co-ordinating and Organizing', 'Management : Supervising', 'Analysis : Analyzing Information', 'Analysis : Planning', 'Communication : Advising and Consulting', 'Communication : Teaching and Training', 'Information Handling : Processing Information']","['Business, Finance and Management : Personnel and Human Resources', 'Engineering and Technology : Building and Construction', 'Engineering and Technology : Mechanics and Machinery', 'Manufacturing and Production : Processing and Production']"
NOC 9227,"['Establish work schedules', 'Oversee safety of operations', 'Set up machines and equipment', 'Supervise, co-ordinate and schedule (and possibly review) activities of workers', 'Resolve work problems and recommend measures to improve productivity', 'Recommend measures to improve productivity and product quality']","['Service and Care : Protecting and Enforcing', 'Operating and Repairing Equipment, Machinery and Vehicles : Mechanical Installing, Maintaining and Repairing', 'Management : Co-ordinating and Organizing', 'Management : Supervising', 'Analysis : Analyzing Information', 'Analysis : Planning', 'Communication : Advising and Consulting', 'Communication : Teaching and Training', 'Information Handling : Processing Information']","['Business, Finance and Management : Personnel and Human Resources', 'Engineering and Technology : Mechanics and Machinery', 'Manufacturing and Production : Processing and Production']"
NOC 9411,"['Ensure correct operation of machines and verify specified processing conditions and make adjustments', 'Make adjustments to machinery', 'Set up, prepare and adjust processing machinery', 'Operate single-function machinery to process mineral ores']","['Operating and Repairing Equipment, Machinery and Vehicles : Mechanical Installing, Maintaining and Repairing', 'Operating and Repairing Equipment, Machinery and Vehicles : Operating Stationary Industrial Equipment', 'Analysis : Analyzing Information', 'Information Handling : Processing Information']","['Engineering and Technology : Mechanics and Machinery', 'Manufacturing and Production : Processing and Production', 'Mathematics and Science : Chemistry']"
NOC 7294,"['Prepare, clean and sand surfaces to be painted', 'Repair cracks and holes', 'Mix paint to desired colour and texture', 'Measure, cut and apply wallpaper and other fabric to walls', 'Advise consumers on colours and choice of wall coverings', 'Erect scaffolding and swing stages and attach rigging', 'Apply paint, wallpaper and other materials and finishes to interior and exterior surfaces']","['Building : Finishing Building Interior/Exterior', 'Building : Restoring and Repairing', 'Analysis : Analyzing Information', 'Analysis : Planning', 'Analysis : Projecting Outcomes', 'Communication : Advising and Consulting']","['Business, Finance and Management : Client  Service', 'Engineering and Technology : Building and Construction', 'Law and Public Safety : Public Safety and Security']"
NOC 7312,"['Troubleshoot and inspect equipment to detect faults and malfunctions', 'Diagnose faults or malfunctions using computerized and other testing equipment to determine extent of repair required', 'Adjust equipment and repair or replace defective parts', ""Test repaired equipment for proper performance and to ensure that work meets manufacturers' specifications"", 'Clean, lubricate and perform other maintenance work', 'Service attachments and working tools', 'Verify and repair emission control systems']","['Working with Technological Equipment and Machinery : Using Specialized Instrumentation and Equipment', 'Operating and Repairing Equipment, Machinery and Vehicles : Mechanical Installing, Maintaining and Repairing', 'Analysis : Inspecting and Testing', 'Analysis : Examining and Diagnosing', 'Analysis : Analyzing Information', 'Information Handling : Processing Information']","['Engineering and Technology : Mechanics and Machinery', 'Law and Public Safety : Public Safety and Security']"
NOC 7313,"['Measure and lay out reference points for installation', 'Assemble and install refrigeration or air conditioning components', 'Measure, cut and connect piping using welding and brazing equipment', 'Start up system and test for leaks using testing devices', 'Recharge system with refrigerant, check and test regulators, calibrate system and perform routine maintenance or servicing', 'Interpret gas codes', 'Install, troubleshoot, repair and overhaul entire heating, ventilation, air handling, refrigeration and air conditioning systems', 'Handle, recover and store refrigerants', 'Install, maintain and repair equipment in refrigerated trucks used to transport food or medical supplies', 'Repair and replace parts and components for entire refrigeration, air conditioning, ventilation or heat pump systems', 'Read and interpret blueprints']","['Working with Technological Equipment and Machinery : Using Specialized Instrumentation and Equipment', 'Operating and Repairing Equipment, Machinery and Vehicles : Mechanical Installing, Maintaining and Repairing', 'Building : Installing Building Interior Infrastructure', 'Analysis : Inspecting and Testing', 'Analysis : Planning', 'Analysis : Examining and Diagnosing', 'Analysis : Projecting Outcomes', 'Analysis : Analyzing Information', 'Information Handling : Processing Information']","['Engineering and Technology : Mechanics and Machinery', 'Engineering and Technology : Building and Construction', 'Law and Public Safety : Public Safety and Security']"
NOC 7314,"['Inspect interior and exterior components of freight, passenger and urban transit rail cars to determine defects and extent of wear and damage', 'Repair defective or damaged metal and wood components', 'Repair and install railway car parts', 'Repair and repaint wooden fixtures', 'Replace damaged windows and repair upholstery', 'Test and adjust parts', 'Repair and maintain electrical and electronic controls for propulsion and braking systems', 'Perform and document routine maintenance']","['Working with Technological Equipment and Machinery : Installing and Setting-Up Technical Infrastructure', 'Operating and Repairing Equipment, Machinery and Vehicles : Mechanical Installing, Maintaining and Repairing', 'Building : Restoring and Repairing', 'Analysis : Analyzing Information', 'Analysis : Examining and Diagnosing', 'Analysis : Inspecting and Testing', 'Information Handling : Processing Information']","['Engineering and Technology : Electricity (Electrical and Electronics)', 'Engineering and Technology : Engineering and Applied Technologies', 'Engineering and Technology : Mechanics and Machinery', 'Law and Public Safety : Public Safety and Security']"
NOC 7315,"['Inspect structural and mechanical systems of aircraft and ensure that these systems meet Transport Canada and company standards of performance and safety', 'Inspect work of aircraft mechanics performing maintenance, repair and overhaul to ensure adherence to standards and procedures', 'Maintain detailed repair, inspection and certification records and reports', 'Inspect work of aircraft mechanics performing modification of aircraft and aircraft mechanical systems to ensure adherence to standards and procedures', 'Troubleshoot aircraft structural, mechanical or hydraulic systems to identify problems and adjust and repair systems according to specifications, technical drawings, manuals and established procedures', 'Repair and overhaul aircraft structural, mechanical or hydraulic systems', 'Install or modify aircraft engines and mechanical, hydraulic, flight control, fuel and pneumatic systems', 'Dismantle airframes, aircraft engines or other aircraft systems for repair, overhaul and cleaning, and reassemble', 'Perform and document routine maintenance', 'Order and maintain inventory of parts and supplies', 'Interpret blueprints/specifications/standards and written technical instructions']","['Operating and Repairing Equipment, Machinery and Vehicles : Mechanical Installing, Maintaining and Repairing', 'Analysis : Analyzing Information', 'Analysis : Examining and Diagnosing', 'Analysis : Inspecting and Testing', 'Communication : Professional Communicating', 'Information Handling : Processing Information']","['Engineering and Technology : Engineering and Applied Technologies', 'Engineering and Technology : Mechanics and Machinery', 'Law and Public Safety : Public Safety and Security']"
NOC 7316,"['Fit and assemble prefabricated metal parts to build heavy industrial machinery', 'Move and align subassemblies and components', 'Install major components such as gears, pumps, motors or hydraulic assemblies', 'Inspect furniture and fixture subassemblies and finished products for conformance to quality standards', 'Read and interpret blueprints']","['Operating and Repairing Equipment, Machinery and Vehicles : Mechanical Installing, Maintaining and Repairing', 'Operating and Repairing Equipment, Machinery and Vehicles : Operating Stationary Industrial Equipment', 'Building : Constructing', 'Analysis : Analyzing Information', 'Analysis : Inspecting and Testing', 'Information Handling : Processing Information', 'Handling Goods and Materials : Loading and Unloading']","['Engineering and Technology : Mechanics and Machinery', 'Manufacturing and Production : Processing and Production']"
NOC 7322,"['Review damage report and estimates of repair cost and plan work to be performed', 'Replace front end components, body components, doors and frame and underbody components', 'File, grind and sand body surfaces to be repaired', 'Mask and tape auto body surfaces in preparation for painting', 'Hammer out dents, buckles and defects using blocks and hammers', 'Remove damaged fenders, panels and grills and bolt or weld replacement parts into place', 'Apply primers and repaint surfaces', 'Repair or replace interior components', 'Repair or replace damaged windows, windshields and sunroofs', 'Inspect repaired vehicles and test drive vehicles for proper handling', 'Operate soldering equipment or use plastic filler to fill holes, dents and seams', 'Straighten bent frames using frame and underbody pulling and anchoring equipment', 'Mix paint, blend and match colors']","['Operating and Repairing Equipment, Machinery and Vehicles : Mechanical Installing, Maintaining and Repairing', 'Building : Restoring and Repairing', 'Analysis : Inspecting and Testing', 'Analysis : Analyzing Information', 'Information Handling : Processing Information']",['Engineering and Technology : Mechanics and Machinery']
NOC 7331,"['Troubleshoot and repair malfunctioning oil burners, and their components and controls', 'Lay out oil burner heating system components and assemble components using hand and power tools', 'Test installed unit and adjust controls for proper functioning', 'Perform scheduled maintenance and service', 'Instruct apprentices', 'Install oil burner components and connect to fuel supply, ventilation and electrical system', 'Read and interpret blueprints, maps, drawings and specifications', 'Install, maintain and repair coal and wood heating systems']","['Operating and Repairing Equipment, Machinery and Vehicles : Mechanical Installing, Maintaining and Repairing', 'Analysis : Analyzing Information', 'Analysis : Examining and Diagnosing', 'Analysis : Inspecting and Testing', 'Analysis : Planning', 'Information Handling : Processing Information']","['Engineering and Technology : Electricity (Electrical and Electronics)', 'Engineering and Technology : Mechanics and Machinery', 'Law and Public Safety : Public Safety and Security']"
NOC 7332,"['Conduct voltage, resistance and other tests using electrical test equipment', 'Refer to schematic drawings or product manuals to repair parts', 'Diagnose faults, using testing devices', 'Repair electrical appliances and components', 'Replace faulty components', 'Use shop equipment and specialized diagnostic and programming apparatus to repair, adjust and reprogram appliances', 'Advise customers on work performed and condition of equipment']","['Service and Care : Serving Others', 'Operating and Repairing Equipment, Machinery and Vehicles : Mechanical Installing, Maintaining and Repairing', 'Analysis : Inspecting and Testing', 'Analysis : Planning', 'Analysis : Examining and Diagnosing', 'Analysis : Projecting Outcomes', 'Analysis : Analyzing Information', 'Information Handling : Processing Information']","['Business, Finance and Management : Client  Service', 'Engineering and Technology : Mechanics and Machinery', 'Engineering and Technology : Electricity (Electrical and Electronics)']"
NOC 7333,"['Test and observe electrical and mechanical conditions of equipment', 'Troubleshoot and repair electric motors, transformers, switchgear, generators and other electro-mechanical equipment', 'Replace or recondition shafts, bearings, commutators and other components', 'Wind, assemble and install various types of coils', 'Perform static or dynamic balancing of armatures or rotors', 'Perform some machining to recondition or modify shafts, commutators or other parts', 'Perform on-site servicing and repair', 'Test and repair or replace faulty wiring or components in electrical switchgear', 'Test repaired motors, transformers, switchgear or other electrical apparatus to ensure proper performance']","['Operating and Repairing Equipment, Machinery and Vehicles : Mechanical Installing, Maintaining and Repairing', 'Operating and Repairing Equipment, Machinery and Vehicles : Operating Stationary Industrial Equipment', 'Analysis : Analyzing Information', 'Analysis : Examining and Diagnosing', 'Analysis : Inspecting and Testing', 'Information Handling : Processing Information']","['Engineering and Technology : Electricity (Electrical and Electronics)', 'Engineering and Technology : Mechanics and Machinery', 'Manufacturing and Production : Processing and Production']"
NOC 6343,"['Discuss type of footwear to be made and obtain measurements from customer', 'Outline and cut patterns', 'Trim, dress and finish boots or shoes', 'Repair soles, heels and other parts of footwear', 'Repair belts, purses, luggage and similar products']","['Service and Care : Serving Others', 'Operating and Repairing Equipment, Machinery and Vehicles : Operating Stationary Industrial Equipment', 'Management : Supervising', 'Building : Constructing', 'Building : Restoring and Repairing', 'Analysis : Projecting Outcomes']","['Business, Finance and Management : Client  Service', 'Engineering and Technology : Building and Construction']"
NOC 7361,"['Operate locomotives to switch, couple and uncouple cars for loading and unloading', 'Inspect locomotives, replenish fuel or perform routine maintenance on locomotives', 'Perform switching operations according to written switching orders or dispatched instructions', 'Operate locomotives on railways', 'Operate communication systems to communicate with train crews and traffic controllers to ensure safe operation and scheduling of trains', 'Inspect assigned locomotives and test operating controls and equipment']","['Operating and Repairing Equipment, Machinery and Vehicles : Mechanical Installing, Maintaining and Repairing', 'Operating and Repairing Equipment, Machinery and Vehicles : Operating Mobile Equipment', 'Analysis : Inspecting and Testing', 'Analysis : Analyzing Information', 'Information Handling : Processing Information']","['Communications and Transportation : Transportation', 'Engineering and Technology : Mechanics and Machinery', 'Law and Public Safety : Public Safety and Security']"
NOC 7362,"['Check train systems and equipment prior to train run', 'Communicate with train crew members to aid in the movement and operation of train', 'Receive orders from traffic controllers, observe signals and track conditions and open and close track switches', 'Set and release hand brakes and connect air brake hoses to couple and switch passenger or freight cars, making minor repairs to couplings, air hoses and wheel-bearing boxes as required', 'Assist in collecting fares and helping passengers on and off train', 'Receive train orders and explain orders to brakemen/women, locomotive engineer and other crew members', 'Collect fares on board passenger trains, announce approaching train stops and answer passenger enquiries', 'Supervise and co-ordinate the activities of passenger and freight train crew members (except locomotive engineers)', 'Prepare train run reports', 'Communicate with train crew members to give and receive train operation information']","['Service and Care : Serving Others', 'Operating and Repairing Equipment, Machinery and Vehicles : Mechanical Installing, Maintaining and Repairing', 'Management : Co-ordinating and Organizing', 'Analysis : Inspecting and Testing', 'Information Handling : Processing Information']","['Business, Finance and Management : Client  Service', 'Communications and Transportation : Transportation', 'Engineering and Technology : Mechanics and Machinery', 'Law and Public Safety : Public Safety and Security']"
