noc,description,duties,titles,related_occupations
NOC 5254,"Program leaders and instructors in recreation, sport and fitness lead and instruct groups and individuals in recreational, sports, fitness or athletic programs. They are employed by community centres, sports and fitness clubs, outdoor centres, resorts, recreational facilities, health care facilities, retirement homes, correctional institutions, government departments, private businesses, tourism associations and similar establishments.","['Plan and carry out recreational, athletic, fitness and sports activities', 'Assemble supplies and sports and game equipment', 'Demonstrate and instruct athletic, fitness or sports activities and techniques', 'Instruct groups and individuals in arts, crafts and similar activities and lead groups and individuals in recreational or leisure programs', 'Attend to clients with special needs', 'Provide lifestyle awareness information', 'Conduct therapeutic recreational or athletic activities', 'Monitor recreational, sports or fitness activities to ensure safety and provide emergency or first aid assistance when required', 'Enforce safety rules and regulations', 'Assist with co-ordination of special events', 'Schedule activities, keep logs, maintain records and prepare reports', 'May train and supervise staff', 'May maintain and repair sports equipment.']","['recreation technician', 'lifeguard', 'day camp leader', 'camp counsellor', 'riding instructor', 'fitness instructor', 'aerobics instructor', 'swimming instructor - sports', 'recreation program leader', 'ski instructor', 'playground worker', 'ski patrol', 'gymnastics teacher', 'fitness appraiser', 'certified personal trainer', 'personal trainer']","['Recreation, sports and fitness program and service directors', 'Recreation, sports and fitness policy researchers, consultants and program officers', 'Other instructors']"
NOC 4311,"Police officers protect the public, detect and prevent crime and perform other activities directed at maintaining law and order. They are employed by municipal and federal governments and some provincial and regional governments.","['Patrol assigned areas to maintain public safety and order and to enforce laws and regulations', 'Investigate crimes and accidents, execute search warrants, secure evidence, interview witnesses, compile notes and reports and provide testimony in courts of law', 'Apprehend and arrest criminal suspects', 'Provide emergency assistance to victims of accidents, crimes and natural disasters', 'Participate in crime prevention, public information and safety programs', 'May supervise and co-ordinate the work of other police officers.']","['detective - police', 'community relations officer - police', 'RCMP officer', 'police cadet', 'constable', 'police officer', 'crime prevention constable', 'harbour police officer', 'highway patrol officer', 'railway police officer', 'police sergeant', 'police diver']","['Commissioned police officers', 'By-law enforcement and other regulatory officers, n.e.c.', 'Security guards and related security service occupations', 'Sheriffs and bailiffs']"
NOC 7252,"Steamfitters and pipefitters lay out, assemble, fabricate, maintain, troubleshoot and repair piping systems carrying water, steam, chemicals and fuel in heating, cooling, lubricating and other process piping systems. Sprinkler system installers fabricate, install, test, maintain and repair water, foam, carbon dioxide and dry chemical sprinkler systems in buildings for fire protection purposes. Steamfitters, pipefitters and sprinkler system installers are employed in maintenance departments of factories, plants and similar establishments, and by pipefitting and sprinkler system contractors, or they may be self-employed.","['Steamfitters and pipefitters', 'Read and interpret drawings, blueprints and specifications to determine layout requirements', 'Cut openings for pipe in walls, floors and ceilings using hand or power tools or machines', 'Select type and size of pipe required', 'Measure, cut, thread and bend pipe to required shape using hand and power tools', 'Weld, braze, cement, solder and thread joints to join pipes and fabricate sections of piping system', 'Install supports, valves, piping and control systems', 'Test system for leaks using testing equipment', 'Clean and maintain pipe units and fittings and flush system', 'Remove and replace worn components and reactivate system', 'May prepare cost estimates for clients.', 'Sprinkler system installers', 'Read and interpret drawings, specifications and fire codes to determine layout requirements', 'Install clamps, brackets and hangers to support piping system and sprinkler and fire protection equipment, using hand and power tools', 'Select, measure, cut, ream and thread pipe, install sprinkler heads and mount prepared pipe in supports', 'Join pipes and piping sections using soldering and welding equipment', 'Connect piping system to water mains, supply tanks, pumps, compressors and control equipment', 'Installs valves, alarms and associated equipment', 'Test system for leaks using air or liquid pressure equipment', 'Service and repair sprinkler system', 'May prepare cost estimates for clients.']","['fire protection mechanic', 'pipefitter', 'steamfitter', 'sprinkler system fitter', 'sprinkler system installer', 'marine pipefitter', 'fire sprinkler fitter', 'apprentice pipefitter-steamfitter', 'steamfitter-pipefitter']","['Residential and commercial installers and servicers', 'Plumbers', 'Gas fitters', 'Contractors and supervisors, pipefitting trades']"
NOC 7284,"Plasterers apply finish, and maintain and restore plaster or similar materials, on interior and exterior walls, ceilings and building partitions to produce plain or decorative surfaces. Drywall installers and finishers install and finish drywall sheets and various types of ceiling systems. Lathers install support framework for ceiling systems, interior and exterior walls and building partitions. They are employed by construction companies and by plastering, drywalling and lathing contractors, or they may be self-employed.","['Plasterers', 'Clean and prepare surfaces', 'Mix plaster ingredients in trough to desired consistency', 'Apply, level and smooth coats of plaster using trowels, floats, brushes and spraying equipment', 'Trowel or spray coats of stucco over exteriors of buildings to form weatherproof surfaces', 'Finish corners and angles and create decorative designs in finish coat, if required', 'Cure freshly plastered surfaces', 'Mould and install ornamental plaster panels, cornices and trim', 'Spray acoustic materials or texture finish over walls and ceilings.', 'Drywall installers and finishers', 'Measure, cut and fit drywall sheets for installation on walls and ceilings', 'Position and secure sheets to metal or wooden studs or joists', 'Cut and install metal corner beads to protect exterior corners', 'Fill joints, nail indentations, holes and cracks with joint compound using trowel and broad knife', 'Tape over joints using taping machine and embed tape in compound', 'Smooth out excess compound and allow coat to dry', 'Apply successive coats of compound and sand seams and joints', 'Fabricate and install suspended metal ceiling grids and place in panels to form acoustical and coffered ceilings.', 'Lathers', 'Prepare wall and ceiling layouts', 'Install metal stud framing and furring for interior drywall or plaster walls and ceilings, using hand and power tools', 'Attach metal or gypsum lath to studs or furring using nails, screws, clips or wire ties', 'Cut openings in lath for heating and ventilation piping, ducts and electrical outlets', 'Install corner beads and wire mesh around beams to which plaster is to be applied', 'May install acoustic tile, hangers for suspended ceilings and metal studs for composition wallboard or lath.']","['wood lather', 'plasterer apprentice', 'ceiling installer', 'drywall applicator', 'drywall finisher', 'drywall taper', 'plasterer', 'lather', 'lather apprentice', 'acoustical ceiling installer', 'sheetrock applicator', 'drywall installer and finisher apprentice', 'lather (interior systems mechanic)']","['Contractors and supervisors, other construction trades, installers, repairers and servicers']"
NOC 7295,"Floor covering installers install carpet, wood, linoleum, vinyl and other resilient floor coverings in residential, commercial, industrial and institutional buildings. They are employed by construction companies, floor-covering contractors and carpet outlets, or they may be self-employed.","['Inspect, measure and mark surfaces to be covered', 'Measure, cut and fasten underlay and underpadding', 'Measure, cut and install carpeting using hand or machine stitcher, seaming iron, bonding tape or other bonding materials', 'Stretch carpeting using knee-kicker or power stretcher and secure carpeting to floor or other surfaces using staple gun or other devices', 'Measure, cut and install resilient floor covering using adhesive, rollers and other hand tools', 'Install hardwood floors, such as strip floors, block floors or plank floors, using glue, staples, nails or other means', 'Inspect and repair damaged floor coverings', 'May estimate material and labour costs.']","['hardwood floor layer', 'floor covering installer apprentice', 'floor covering mechanic', 'carpet layer', 'vinyl floor installer', 'resilient floor installer', 'residential floor and wall covering installer']","['Contractors and supervisors, other construction trades, installers, repairers and servicers']"
NOC 7335,"Other small engine and small equipment repairers test, repair and service small gasoline and diesel-powered engines and equipment, such as garden tractors, lawn mowers and other related equipment. They are employed by dealer service shops and by independent service establishments.","['Review work orders and discuss work to be performed with supervisor', 'Inspect and test engines and other mechanical components using test devices to diagnose and isolate faults', 'Adjust, repair or replace mechanical or electrical system parts and components using hand tools and equipment', 'Test and adjust repaired equipment for proper performance', 'Perform scheduled maintenance service on equipment', 'Advise customers on work performed and general condition of equipment', 'Determine estimates of repair cost.']","['air-cooled engine mechanic', 'small equipment repairer', 'gasoline powered lawn mower repairer', 'lawn and garden equipment technician', 'small engine technician', 'small equipment mechanic apprentice']","['Contractors and supervisors, mechanic trades', 'Appliance servicers and repairers', 'Motorcycle, all-terrain vehicle and other related mechanics']"
NOC 6342,"Tailors, dressmakers and furriers make, alter and repair tailored clothing, dresses, coats and other made-to-measure garments. Milliners make, alter and repair hats. This unit group also includes alterationists who fit, alter and repair garments. They are employed by clothing retailers, clothing alteration shops, dry cleaners and garment manufacturing companies or they may be self-employed.","['Tailors', ""Make made-to-measure garments, such as suits and coats according to customers' and clothing manufacturers' specifications and fit"", 'Design patterns to fit measurements', 'Mark, cut and sew fabric', 'May alter and repair garments as required.', 'Dressmakers', ""Make women's garments"", ""Select and modify commercial patterns to customers' and clothing manufacturers' specifications"", 'Fit, mark, cut and sew fabric', 'May alter and repair garments as required.', 'Furriers', 'Make, alter, restyle and repair natural fur garments and accessories.', 'Milliners', 'Design, lay out, cut, sew and press fabric, leather and other materials into hats and related accessories.', 'Alterationists', ""Fit, alter and repair garments according to customers' requests by hand or using sewing machines.""]","['alterations dressmaker', 'custom furrier', 'garment alterationist', 'custom tailor', 'alterationist, garments', 'seamstress', 'furrier', 'milliner', 'tailor']","['Theatre, fashion, exhibit and other creative designers']"
NOC 7514,"Delivery and courier service drivers drive automobiles, vans and light trucks to pick up and deliver various products. They are employed by dairies, drug stores, newspaper distributors, take-out food establishments, dry cleaners, mobile caterers, courier and messenger service companies and many other establishments, or they may be self-employed.","['Operate and drive automobiles, vans and light trucks to pick up and deliver various products, such as fast food, newspapers, magazines, bakery and dairy products, and items such as dry cleaning, envelopes, packages and parcels', 'Perform pre-trip and post-trip inspection of vehicle', 'Plan delivery travel schedules and service routes', 'Load and unload cargo, goods or merchandise', 'Provide customer service by selling products, delivering over established routes and accepting or making payments for goods', 'Record information on pick-ups and deliveries, vehicle mileage and fuel costs and report any incidents or problems encountered', 'May scan and sort freight or cargo for delivery', 'May assemble, install or set-up delivered goods or merchandise', 'May communicate with central dispatch using mobile communications equipment.']","['driver salesperson', 'canteen driver', 'delivery driver', 'bread deliverer', 'pizza delivery driver', 'newspaper delivery driver', 'dry cleaning driver', 'vending machine driver-supplier', 'mail service courier', 'courier service driver']","['Couriers, messengers and door-to-door distributors', 'Supervisors, motor transport and other ground transit operators', 'Transport truck drivers', 'Public works maintenance equipment operators and related workers', 'Railway and motor transport labourers', 'Dispatchers']"
NOC 7531,"Railway yard workers regulate yard traffic, couple and uncouple trains and perform related yard activities. Railway track maintenance workers operate machines and equipment to lay, maintain and repair railway tracks. They are employed by railway transport companies.","['Operate control panel switches from railway yard tower to set traffic signals and to activate train switches that regulate railway traffic in railway yards', 'Operate car retarders, turntables and track switches to align locomotives and cars as required for coupling, uncoupling or servicing', 'Operate machines and equipment to lay, maintain and repair railway tracks, align tracks, transfer, spread, level and tamp ballast around ties and rails and to clear snow from tracks', 'Switch cars according to instructions which indicate the location, disposition and number of cars', 'Lubricate moving parts of railway cars and locomotives', 'Clean and make minor repairs to machines and equipment', 'Patrol assigned track sections to identify and report damaged or broken track', 'Perform other track maintenance duties as directed.']","['trackman/woman, railway', 'railway equipment operator', 'switch tender - railway yard', 'yard coupler - railway', 'signal tower operator - railway', 'control tower operator - railway', 'towerman/woman - railway transport', 'car controller - railway', 'yard worker - railway', 'spike machine operator - railway', 'ballast regulator operator - railway', 'rail saw operator', 'track patroller, railway', 'equipment operator, railway', 'machine operator - railway', 'tie tamper operator - railway', 'section worker - railway']","['Supervisors, railway transport operations', 'Railway conductors and brakemen/women', 'Railway and motor transport labourers', 'Contractors and supervisors, heavy equipment operator crews']"
NOC 7532,"Water transport deck and engine room crew stand watch, operate and maintain deck equipment, perform other deck and bridge duties and assist ship engineer officers to operate, maintain and repair engines, machinery and auxiliary equipment aboard ships or self-propelled vessels. They are employed by marine transportation companies and federal government departments.","['Stand watch and steer ship or self-propelled vessel under the direction of the officer on watch', 'Operate, maintain and repair deck equipment such as winches, cranes, derricks and hawsers', ""Assist ship engineer officers in performing routine maintenance work and repair to ship's engine, machinery and auxiliary equipment"", 'Monitor engine, machinery and equipment indicators, record variables and report abnormalities to ship engineer officer on watch', 'Lubricate moving parts of engines, machinery and auxiliary equipment', 'Operate and maintain off-loading liquid pumps and valves', 'Clean engine parts and keep engine room clean', 'Clean, chip and paint deck surfaces', 'Handle mooring lines, and splice and repair ropes, wire cables and cordage.']","['boatswain - water transport', 'engine room crew member - ship', 'helmsman/woman - water transport', 'marine engineering mechanic', 'able seaman/woman (except armed forces)', 'deckhand', 'ship tunnel operator', 'ship stoker', 'marine engine oiler', 'able seaman/woman - except armed forces']","['Deck officers, water transport', 'Engineer officers, water transport', 'Fishing vessel deckhands']"
NOC 8222,"Contractors and supervisors in oil and gas drilling and services supervise and co-ordinate the activities in drilling for oil or gas, operating service rigs, or providing oil and gas well services. They are employed by drilling and well service contracting companies and petroleum producing companies. Contractors may be self-employed.","['Supervise, co-ordinate and schedule the activities of workers who drill for oil and gas, operate service rigs or provide oil and gas well services', 'Establish methods to meet work schedules and co-ordinate work activities with other departments', 'Requisition and procure materials and supplies', 'Resolve work problems and recommend measures to improve productivity and safety', 'Train workers in job duties, safety procedures and company policies', 'Recommend personnel actions such as hirings and promotions', 'Prepare production and other reports', 'May set up machines and equipment.']","['oil field consultant', 'multi-service operator - oil field services', 'fracturing supervisor', 'rig manager', 'toolpusher', 'well services crew supervisor']","['Geological and mineral technologists and technicians', 'Managers in natural resources production and fishing', 'Oil and gas well drillers, servicers, testers and related workers', 'Oil and gas well drilling and related workers and services operators']"
NOC 8241,"Logging machinery operators operate cable yarding systems, mechanical harvesters and forwarders and mechanical tree processors and loaders to fell, yard and process trees at logging sites. They are employed by logging companies and contractors.","['Cable yarding system operators', 'Operate machines to transport trees from logging areas to landing or log loading sites in mountainous terrain in western Canada.', 'Mechanical harvester and forwarder operators', 'Assess site and terrain and drive heavy equipment to perform a combination of felling, slashing, bucking, bunching and forwarding operations at logging areas.', 'Mechanical tree processor and loader operators', 'Operate a variety of machines which perform a combination of slashing, bucking, chipping, sorting and loading logs or trees at landing sites.']","['rigging slinger - logging', 'yarder operator - logging', 'steel spar operator - logging', 'chipping machine operator', 'delimber operator', 'loader operator - logging', 'log processor operator', 'slasher operator - logging', 'feller buncher operator', 'feller forwarder operator', 'shortwood harvester operator', 'treelength forwarder operator', 'linehorse operator', 'grapple operator - logging']","['Transport truck drivers', 'Supervisors, logging and forestry', 'Heavy equipment operators (except crane)', 'Chain saw and skidder operators', 'Silviculture and forestry workers']"
NOC 9537,"Other products assemblers, finishers and inspectors assemble, finish and inspect components or products of various materials, such as jewellery, silverware, buttons, pencils, non-prescription lenses, brushes, clocks and watches, musical instruments, sporting goods, toys and other miscellaneous products. They are employed by a wide variety of manufacturing companies.","['Assemblers and finishers', 'Operate machines or use hand tools to cut, shape and fit materials to form parts and to fabricate components or products', 'Load supplies into hoppers of dispensing units or manually align, feed or otherwise place materials into machines', 'Screw, clip, glue, bond, weld or otherwise assemble parts and components to form final products', 'Sand, trim, grind or clean products into final form using hand tools', 'Clean work stations and remove scraps, dust, shavings or other by-products from machinery and surrounding areas', 'May make routine changes of dies, nozzles or other machinery attachments as required.', 'Inspectors', 'Check manufactured items for defects and for conformance to specifications, visually or using sample models and instruments', 'Affix seals or tags to approved items and return defective products for repair or recycle', 'Complete reports on product inspection.']","['brush making machine operator', 'button machine operator', 'jewellery inspector', 'lampshade assembler', 'antenna assembler', 'toy inspector', 'Venetian blind assembler', 'watch assembler', 'bicycle assembler', 'camera assembly inspector', 'golf club assembler', 'piano assembly inspector', 'eyeglass frame assembler', 'stuffing machine tender', 'tennis ball maker operator', 'sports ball moulder', 'jewellery annealer', 'crayon making machine tender', 'skate press operator', 'prism maker operator']","['Supervisors, other products manufacturing and assembly']"
NOC 8252,"Agricultural service contractors provide agricultural services such as livestock and poultry breeding, soil preparation, crop planting, crop spraying, cultivating or harvesting. Farm supervisors supervise the work of general farm workers and harvesting labourers. Specialized livestock workers carry out feeding, health and breeding programs on dairy, beef, sheep, poultry, swine and other livestock farms. Contractors may be self-employed.","['Agricultural service contractors', 'Provide agricultural livestock services such as artificial insemination, spraying or shearing of livestock or disinfecting pens, barns or poultry houses', 'Provide agricultural crop services such as plowing, irrigating, cultivating, spraying or harvesting', 'Assist in the development and implementation of farm safety and bio-security procedures', 'Hire and train workers', 'Negotiate the terms of services to be provided', 'Maintain financial and operational records', 'May participate in the provision of services or in the operation of machinery and equipment.', 'Farm supervisors', 'Co-ordinate, assign and supervise the work of general farm workers and harvesting labourers', 'Supervise and oversee breeding and other livestock-related programs', 'Supervise, monitor and enforce procedures to maintain animal and crop health and welfare', 'Supervise and oversee growing and other crop-related operations', 'Supervise maintenance of infrastructure, equipment, and supplies', 'Develop work schedules and establish procedures', 'Ensure farm safety, food safety and security and bio-security procedures are followed', 'Maintain quality control and production records', 'May perform general farm duties.', 'Farm supervisors may specialize in areas such as dairy, poultry, swine, beef, sheep, equine, fruit, vegetable, mixed or other specialty farming.', 'Specialized livestock workers', 'Formulate feeding programs', 'Implement pasture or pen breeding programs', 'Follow safety and bio-security procedures', 'Recognize and treat certain livestock health problems', 'Maintain livestock performance records', 'Select livestock for sale', 'Train horses', 'Perform general farm duties', 'May supervise general farm workers.', 'Specialized livestock workers usually specialize in one type of farm animal such as beef cattle, dairy cattle, poultry or swine.']","['pork production technician', 'poultry farm foreman/woman', 'swine herdsperson', 'dairy herdsperson', 'farm foreman/woman', 'farm supervisor', 'feedlot foreman/woman', 'ranch foreman/woman', 'hog operation supervisor', 'horse trainer', 'artificial inseminator', 'crop dusting contractor', 'cattle herdsperson', 'contractor, artificial insemination service', 'contractor, crop harvesting service', 'livestock breeding service contractor', 'vegetable farm foreman/woman']","['Managers in agriculture', 'Managers in horticulture', 'Harvesting labourers', 'Pet groomers and animal care workers', 'General farm workers', 'Pest controllers and fumigators']"
