noc,description,duties,titles,related_occupations
NOC 2255,"Technical occupations in geomatics include aerial survey, remote sensing, geographic information systems, cartographic and photogrammetric technologists and technicians, who gather, analyze, interpret and use geospatial information for applications in natural resources, geology, environmental research and land use planning. Meteorological technologists and technicians observe weather and atmospheric conditions, record, interpret, transmit and report on meteorological data, and provide weather information to the agricultural, natural resources and transportation industries and the public. Geomatics technologists and technicians are employed by all levels of government, utilities, mapping, computer software, forestry, architectural, engineering and consulting firms and other related establishments. Meteorological technologists and technicians are employed by all levels of government, the media, natural resources, utilities and transportation companies and consulting firms.","['Aerial survey and remote sensing technologists and technicians', 'Operate analog or digital airborne remote sensing equipment such as survey film or digital cameras, laser or radar sensors and scanners to prepare images, data and graphic reports, maps and charts from airborne or satellite data', 'Develop specialized analog and computer software specific routines to customize and integrate image analysis', 'Inspect quality of recorded images, verify the integrity and accuracy of data contained in remote sensing image analysis systems, and adjust equipment as required.', 'Geographic information systems (GIS) technologists and technicians', 'Operate specialized computer hardware and software and peripheral equipment to model, manage, analyze and display geospatial data', 'Develop specialized computer software routines, Internet-based GIS, database and business applications to customize geographic information', 'Work with external organizations on data transfer and systems compatibility issues', 'Perform data entry and editing activities and maintenance operations to systems following predetermined calibration procedures', 'Integrate external software such as spreadsheets and statistical packages with GIS software', 'Train and provide technical support for GIS users.', 'Cartographic technologists and technicians', 'Plan map content, format and design and compile required data from aerial photographs, survey notes, records, reports and other maps', 'Generate maps and related graphs and charts using digital mapping techniques, computer interactive graphics, computer-assisted design and drafting (CAD) software, traditional drafting methods and computer or traditional scribing tools', 'Inspect final compositions to ensure completeness and accuracy.', 'Photogrammetric technologists and technicians', 'Examine and interpret aerial photographs to prepare topographic maps, aerial-photograph mosaics and related charts', 'Operate digitized stereoscopic plotting and computer graphics equipment to provide three-dimensional optical models of terrain, to trace maps, and to prepare charts and tables', 'Monitor recording quality and adjust equipment as required and inspect quality of recorded images.', 'Meteorological technologists and technicians', 'Observe, record and transmit atmospheric and weather information including air pressure, temperature, humidity, precipitation and cloud, wind and ultraviolet conditions', 'Observe, chart and report on ice conditions in navigable waters and snow conditions, and participate in programs to forecast and control avalanches in mountainous terrain', 'Maintain climatological databases, analyze and interpret weather data and participate in the production of weather maps, charts and reports', 'Install, inspect, monitor, calibrate and maintain meteorological equipment and instruments.']","['weather station officer-in-charge', 'softcopy photogrammetrist', 'aerological technician', 'avalanche controller', 'climate data processor', 'climate service technician', 'meteorological inspector', 'ice observer', 'officer-in-charge, weather station', 'operations technician, weather station', 'surface weather observer', 'meteorological technician', 'aerial survey technician', 'cartographer', 'mapping technician', 'map editor', 'geographic information systems (GIS) technician', 'photogrammetric technologist', 'photogrammetrist', 'remote sensing (RS) technician']","['Geological and mineral technologists and technicians', 'Meteorologists and climatologists', 'Drafting technologists and technicians', 'Civil engineering technologists and technicians', 'Land survey technologists and technicians', 'Civil engineers', 'Land surveyors']"
NOC 2221,"Biological technologists and technicians provide technical support and services to scientists, engineers and other professionals working in fields such as agriculture, resource management, environmental protection, plant and animal biology, microbiology, cell and molecular biology and health sciences, or may work independently in these fields. They are employed in both laboratory and field settings by governments, manufacturers of food products, chemicals and pharmaceuticals, biotechnology companies, health, research and educational institutions, environmental consulting companies, and resource and utilities companies.","['Biological technologists', 'Set up and conduct biological, microbiological and biochemical tests and laboratory analyses in support of research and quality control in food production, sanitation, pharmaceutical production, biotechnology and other fields', 'Apply methods and techniques such as microscopy, histochemistry, chromatography, electrophoresis and spectroscopy', 'Perform experimental procedures in agriculture, plant breeding, animal husbandry, biology and biomedical research', 'Conduct field research and surveys to collect data and samples of water, soil, and plant and animal populations', 'Conduct environmental monitoring and compliance activities for the protection of fisheries stock, wildlife and other natural resources', 'Analyze data and prepare reports', 'Conduct or supervise operational programs such as fish hatchery, greenhouse and livestock production programs.', 'Biological technicians', 'Assist in conducting biological, microbiological and biochemical tests and laboratory analyses', 'Perform limited range of technical functions in support of agriculture, plant breeding, animal husbandry, biology, biomedical research and environmental protection', 'Assist in conducting field research and surveys to collect data and samples of water, soil, and plant and animal populations', 'Assist in analysis of data and preparation of reports.']","['microbiology technologist (except medical)', 'agricultural technician', 'agricultural technologist', 'agrology technician', 'aquaculture technician', 'bacteriological technician', 'biological laboratory technologist', 'botanical technician', 'fish hatchery technician', 'fisheries technician', 'food bacteriological technician', 'microbiology quality control technologist', 'plant breeding technician', 'seed technologist', 'wildlife biology technician']","['Chemical technologists and technicians', 'Agricultural and fish products inspectors', 'Biologists and related scientists', 'Conservation and fishery officers', ""Medical laboratory technicians and pathologists' assistants"", 'Medical laboratory technologists', 'Forestry technologists and technicians', 'Electrical and electronics engineering technologists and technicians']"
NOC 2234,"Construction estimators analyze costs of and prepare estimates on civil engineering, architectural, structural, electrical and mechanical construction projects. They are employed by residential, commercial and industrial construction companies and major electrical, mechanical and trade contractors, or they may be self-employed.","['Prepare estimates of probable costs of materials, labour and equipment for construction projects based on contract bids, quotations, schematic drawings and specifications', 'Advise on tendering procedures, examine and analyze tenders, recommend tender awards and conduct negotiations', 'Establish and maintain tendering process and set up cost monitoring and reporting systems and procedures', 'Prepare cost and expenditure statements and forecasts at regular intervals for the duration of a project', 'Prepare and maintain a directory of suppliers, contractors and subcontractors', 'Liaise, consult and communicate with engineers, architects, owners, contractors and subcontractors, and prepare economic feasibility studies on changes and adjustments to cost estimates', 'Manage and co-ordinate construction projects and prepare construction progress schedules.', 'Estimators may specialize in estimating costs for structural, electrical or mechanical construction projects.']","['chief estimator - construction', 'cost estimator - construction', 'principal estimator - construction', 'quantity surveyor - construction', 'professional quantity surveyor', 'construction estimator']","['Architectural technologists and technicians', 'Civil engineering technologists and technicians', 'Civil engineers', 'Construction managers']"
NOC 6721,"Workers in support occupations in accommodation, travel and facilities set-up services carry hotel guests' luggage and escort guests to their rooms, carry travellers' luggage at airports, in railway stations and aboard ships, clean and maintain public areas and passengers' rooms aboard ships and trains, and set up rooms and associated furnishings, commercial displays, exhibits, equipment and booths in facilities and establishments. They are employed by hotels, conference centres, retail establishments, passenger transport companies and throughout the private and public sectors.","['Guest service attendants', 'Carry luggage for hotel guests, escort incoming guests to their rooms', 'Check rooms to ensure they are in order', 'Offer information regarding features of rooms, services of hotel and points of interest', 'Assist guests with special needs', 'Attend to group arrivals and departures', 'Receive and deliver items and messages for guests', 'Handle guest complaints and requests and maintain luggage storage areas.', 'Baggage porters', ""Convey travellers' luggage at railway stations and airports by hand or hand truck and arrange for ground transportation."", 'Ship attendants', 'Serve food and beverages, clean cabins, make beds, and wash dishes', 'Carry luggage for passengers aboard ships.', 'Train service attendants', 'Set and clear tables in dining cars, serve food and beverages, clean sleeping cars and maintain washroom supplies', 'Ensure customer satisfaction and comfort.', 'Facilities workers', 'Set-up, install, reconfigure, relocate and dismantle temporary partitions and furnishings of rooms', 'Assemble, rotate and disassemble window displays, showcases and signage according to floor plans or instructions', 'Assist with installation of audiovisual equipment and help in resolving problems during use', 'May perform minor repairs on installations and routine maintenance of audiovisual equipment.']","['facilities porter', 'hotel guest services attendant', 'showcase installer', 'banquet porter', 'room flipper', 'luggage attendant', 'baggage porter', 'bellhop', 'doorkeeper, hotel', 'passenger attendant, cruise line', 'train service attendant']","['Support occupations in motion pictures, broadcasting, photography and the performing arts', 'Hotel front desk clerks', 'Air transport ramp attendants', 'Material handlers']"
NOC 2224,"Conservation and fishery officers, inspectors and observers enforce federal and provincial regulations established for the protection of fish, wildlife and other natural resources and collect and relay information on resource management. They are employed by federal and provincial government departments.","['Generate public awareness of fish and wildlife conservation and regulations', 'Conduct patrols by truck, aircraft, boat, or on foot, to ensure compliance with the provincial and federal statutes relating to fish, wildlife and the environment', 'Investigate complaints, arrest violators, prepare briefs and present evidence in court', 'Issue licences, export documents and special permits and collect royalties assessed on fish, wildlife and timber resources', 'Implement and supervise approved techniques in preventing or overcoming damage caused by wildlife', 'Perform resource protection duties, such as inspecting fishing gear and equipment and monitoring fishing activities for compliance with regulations', 'Gather resource data by making inventories of fish, collecting water samples and assisting biologists in scientific research', 'Supervise or provide firearms safety training courses and trapper education courses.']","['conservation officer', 'fish and wildlife officer', 'fishery officer', 'forest ranger - wildlife management', 'game officer', 'game warden', 'natural resources officer', 'park ranger']","['Biological technologists and technicians', 'Agricultural and fish products inspectors', 'Forestry technologists and technicians']"
NOC 4161,"Natural and applied science policy researchers, consultants and program officers conduct research, prepare reports, provide consultation and advice and administer programs in a variety of areas related to the natural and applied sciences. They are employed by federal, provincial and municipal governments, computer and office furniture manufacturers, educational institutions, research organizations, consulting firms, environmental and conservation organizations, or they may be self-employed.","['Ergonomists or human factors specialists', 'Conduct research and advise on, and intervene in the physical, social and psychological interrelationships between persons, their equipment and working or living environments to ensure that the design, configuration and use of equipment, procedures and environmental conditions maximize safety, productivity and comfort.', 'Occupational or industrial hygienists', 'Study, evaluate and control physical, chemical and biological hazards and stresses in the workplace', 'Report and document investigations and conclusions', 'Suggest changes to work environments and processes', 'Provide information to workers and managers or employers on methods to reduce the risk of injury or illness from specific occupational hazards', 'May teach safe work procedures, participate in emergency response planning, testify at hearings and report findings at scientific conferences or in scientific journals.', 'Patent agents', 'Advise clients on elements of patent law and on the patentability of inventions', 'Conduct patent searches', 'Prepare patent applications', 'Represent clients before the patent office.', 'Technology transfer officers', 'Transfer and integrate new technologies, usually from university or government research and development environments, to commercial and industrial applications and ensure the protection of intellectual property of researchers and developers.', 'Science policy and program officers', 'Conduct research and advise on policies or develop or administer programs related to transportation, emergency preparedness, communications, natural resources, agriculture, the environment, traditional and alternative energy technologies, land use, recycling and other scientific fields', 'Promote public awareness and education on issues such as utilization of natural resources, the environment, and reprocessing and reduction of waste.']","['ergonomics specialist', 'certified ergonomist', 'technology transfer officer', 'emergency management analyst', 'emergency preparedness planner', 'supervisor, environmental program development', 'energy policy analyst', 'environmental impact analyst', 'environmental issues lobbyist', 'fisheries analyst', 'industrial hygienist', 'natural resources policy analyst', 'occupational hygienist', 'patent agent', 'program officer, natural and applied sciences', 'scientific consultant', 'transportation safety analyst', 'recycling program co-ordinator']","['Architecture and science managers', 'Lawyers and Quebec notaries', 'Health policy researchers, consultants and program officers']"
NOC 414,"Other managers in public administration plan, organize, direct, control and evaluate the development of policies and programs which govern the daily operations of legislatures and other activities unique to government such as intergovernmental affairs and elections. They are employed by all levels of government.","['Participate in the development of policies and programs by providing advice to senior government managers of legislatures or departments or agencies involved in activities unique to government', 'Organize government unit or agency and establish procedures to meet objectives set by senior management', 'Direct and advise professional and non-professional staff conducting research, preparing documents or providing administrative support', 'Plan, administer and control research and administration budgets for projects, programs, equipment and supplies', 'Organize and direct committees and working groups to plan, manage or evaluate projects and programs', 'Interview, hire and provide training for staff.']","['clerk of the committee - Legislative Assembly', 'director, elections planning', 'director, federal-provincial relations', 'director, intergovernmental affairs']","['Senior government managers and officials', 'Government managers - health and social policy development and program administration', 'Government managers - education policy development and program administration', 'Government managers - economic analysis, policy development and program administration']"
NOC 1252,"Health information management workers collect, code, record, review and manage health information. They are employed by hospitals, clinics, workplace health and safety boards, health record consulting firms and other health care establishments. Health information management workers who are supervisors are included in this unit group.","['Classify and code diseases according to an established classification system', 'Collect, code, cross-reference and store health records and related information', 'Abstract, assemble and analyze clinical data and related demographic information from health records according to established policies and procedures', 'Operate information systems to maintain indexes for classification systems and to manage and retrieve health records information', 'Prepare medical, social and administrative statistics', 'May supervise other health information management technicians and related workers.']","['health information management supervisor', 'medical records unit supervisor', 'health records technician', 'health information management technician']","['Other administrative services managers', 'Professional occupations in business management consulting', 'General office support workers', 'Records management technicians']"
NOC 1253,"Records management technicians operate and maintain systems for the collection, classification, retrieval and retention of records, images, documents and information. They are employed throughout the private and public sectors.","['Implement and update records classification, retention and disposal scheduling plans', 'Classify, code, cross-reference, log and store records', 'Develop document inventories and maintain indexes for classification systems', 'Operate information retrieval systems to research and extract records according to established guidelines in response to requests', 'Label, prepare and transfer information files according to established records management life-cycle procedures and schedules', 'Maintain access lists for security classified records', 'Compile statistics and reports on activities within records management services.']","['records technician', 'microfilm records searcher', 'records classifier', 'records digitizing technician', 'information management technician']","['Professional occupations in business management consulting', 'Supervisors, general office and administrative support workers', 'Library and public archive technicians', 'General office support workers', 'Health information management occupations']"
NOC 3114,"Veterinarians prevent, diagnose and treat diseases and disorders in animals and advise clients on the feeding, hygiene, housing and general care of animals. They work in private practice or may be employed by animal clinics, farms, laboratories, government or industry.","['Diagnose diseases or abnormal conditions in individual animals, herds and flocks through physical examinations or laboratory tests', 'Treat sick or injured animals by prescribing medication, setting bones, dressing wounds or performing surgery', 'Vaccinate animals to prevent and treat diseases', 'Perform routine, emergency and post-mortem examinations', 'Advise clients on feeding, housing, behaviour, breeding, hygiene and general care of animals', 'Provide a range of veterinary services including obstetrics, dentistry and euthanasia', 'May supervise animal health technologists and animal care workers', 'May be responsible for overall operation of animal hospital, clinic or mobile service to farms', 'May conduct veterinary research related to areas such as animal nutrition, health care products development and disease prevention and control', 'May enforce government regulations in disease control and food production including animal or animal-based food inspection.']","['veterinary surgeon', 'farm veterinarian', 'veterinary inspector', 'veterinary pathologist', 'veterinary physiologist', 'small animal veterinary specialist', 'veterinarian', 'zoo veterinarian']","['Biologists and related scientists', 'Animal health technologists and veterinary technicians']"
NOC 1215,"Supervisors of supply chain, tracking and scheduling co-ordination occupations supervise and co-ordinate the activities of workers in the following minor group: Supply chain logistics, tracking and scheduling co-ordination occupations (152). They are employed throughout the public and private sectors.","['Co-ordinate, assign and review the work of clerks engaged in the following duties: shipping, receiving, storing, distributing and maintaining inventories of materials, parts and products; processing purchasing transactions; co-ordinating production work; dispatching crews; scheduling transportation crews and routes; operating airport ramp servicing vehicles; and other related activities', 'Plan, organize and oversee operational logistics of the organization, establish work schedules and procedures, resolve work-related issues, prepare and submit progress and other reports and co-ordinate activities with other supply-chain work units or departments', 'Train workers in job duties, safety procedures and company policies', 'Requisition supplies and materials', 'Ensure smooth operation of computer systems, equipment and machinery and arrange for maintenance and repair work', 'May perform the same duties as workers supervised.']","['head dispatcher', 'head shipper', 'inventory control supervisor', 'supply control co-ordinator', 'production clerks supervisor', 'ramp services supervisor - airport', 'supervisor, receiving', 'parts service supervisor', 'dispatch logistician', 'logistics supervisor - transportation', 'freight forwarding logistician', 'flight crew scheduling supervisor']","['Supervisors, mail and message distribution occupations']"
